Date,Stock_symbol,Article_title
2023-03-19 00:00:00,AAPL,"If You Invested $10,000 in Apple When Warren Buffett First Bought the Stock, Here's How Much You'd Have Now"
2023-03-17 00:00:00,AAPL,Better Buy: Apple vs. Disney
2023-03-17 00:00:00,AAPL,Best FAANG Stock to Buy: Facebook vs. Amazon vs. Apple vs. Netflix vs. Google
2023-03-17 00:00:00,AAPL,"After Hours Most Active for Mar 17, 2023 : LUMN, F, HBI, ABBV, IBM, PEB, INTC, GOOG, AAPL, HBAN, AMZN, VSAT"
2023-03-17 00:00:00,AAPL,"2 Stocks That Could Join Apple, Alphabet, and Microsoft in the $1 Trillion Club"
2023-03-17 00:00:00,AAPL,"Noteworthy ETF Inflows: TQQQ, AAPL, MSFT, AMZN"
2023-03-17 00:00:00,AAPL,Stock Market Sell-Off: Is Apple a Buy?
2023-03-17 00:00:00,AAPL,Better Growth Stock: Nvidia vs. Apple
2023-03-16 00:00:00,AAPL,"3 Hot Stocks for Tomorrow: Friday Predictions for FDX, XPEV, AAPL"
2023-03-16 00:00:00,AAPL,"After Hours Most Active for Mar 16, 2023 : AUY, SWN, FRC, QQQ, AMZN, AAPL, MSFT, INTC, BAC, GOOGL, UMC, JBGS"
2023-03-16 00:00:00,AAPL,"If You Invested $10,000 in Apple Stock in 2013, This Is How Much You Would Have Today"
2023-03-16 00:00:00,AAPL,"EXCLUSIVE-Apple supplier Foxconn wins AirPod order, plans $200 mln factory in India - source"
2023-03-16 00:00:00,AAPL,Guru Fundamental Report for AAPL - Warren Buffett
2023-03-15 00:00:00,AAPL,A Bull Market Is Coming: 3 Big Reasons to Buy Apple Stock Right Now
2023-03-15 00:00:00,AAPL,"EXCLUSIVE-Apple supplier Foxconn wins AirPod order, plans $200 mln factory in India - source"
2023-03-15 00:00:00,AAPL,"After Hours Most Active for Mar 15, 2023 : CS, AMZN, AAPL, AUY, GOOGL, BAC, MSFT, GERN, QQQ, KO, ATUS, PATH"
2023-03-15 00:00:00,AAPL,Apple Stock: Bear vs. Bull
2023-03-15 00:00:00,AAPL,"Apple supplier Foxconn's Q4 profit falls 10% y/y, in line with forecasts"
2023-03-14 00:00:00,AAPL,Guru Fundamental Report for AAPL - Warren Buffett
2023-03-14 00:00:00,AAPL,Apple Rolls Out 'Shop With Specialist Over Video' To Buy IPhone Lineup
2023-03-14 00:00:00,AAPL,"After Hours Most Active for Mar 14, 2023 : IEF, BG, SHV, PODD, AAPL, GOOG, F, AMZN, NRG, KO, TFC, BAC"
2023-03-13 00:00:00,AAPL,Apple's (AAPL) Animation Film Emerges Winner at 2023 Oscars
2023-03-13 00:00:00,AAPL,Apple (AAPL) Gains As Market Dips: What You Should Know
2023-03-13 00:00:00,AAPL,Why Apple Stock Rose Today
2023-03-13 00:00:00,AAPL,"After Hours Most Active for Mar 13, 2023 : AAPL, INTC, BAC, AMZN, CG, CTSH, AER, GTLB, INFY, COTY, KR, SCHW"
2023-03-13 00:00:00,AAPL,"Court revives Apple, Google challenge to U.S. patent-review policy"
2023-03-13 00:00:00,AAPL,Apple Inc. (AAPL) Is a Trending Stock: Facts to Know Before Betting on It
2023-03-13 00:00:00,AAPL,Guru Fundamental Report for AAPL - Warren Buffett
2023-03-12 00:00:00,AAPL,Is It Too Late to Buy Apple Stock?
2023-03-10 00:00:00,AAPL,"Apple argues UK competition watchdog had ""no power"" to launch probe"
2023-03-10 00:00:00,AAPL,"After Hours Most Active for Mar 10, 2023 : SWN, SQQQ, TQQQ, QQQ, CTSH, HPE, AMZN, AAPL, AIG, KO, CHPT, PR"
2023-03-10 00:00:00,AAPL,Apple shareholders reject proposals from conservative groups
2023-03-10 00:00:00,AAPL,Apple shareholders reject proposals from conservative groups
2023-03-10 00:00:00,AAPL,UK says needs more time to review Apple's alleged App Store monopoly
2023-03-10 00:00:00,AAPL,Guru Fundamental Report for AAPL - Warren Buffett
2023-03-10 00:00:00,AAPL,2 Billion Reasons to Buy Apple Stock in 2023 and Hold It Forever
2023-03-09 00:00:00,AAPL,Apple and Foxconn win labour reforms to advance Indian production plans - FT
2023-03-09 00:00:00,AAPL,"3 Hot Stocks for Tomorrow: Thursday Predictions for AAPL, ULTA, AMZN"
2023-03-09 00:00:00,AAPL,"Noteworthy Thursday Option Activity: AMZN, AAPL, EL"
2023-03-09 00:00:00,AAPL,Apple and Foxconn efforts win labour reforms to advance Indian production plans - FT
2023-03-09 00:00:00,AAPL,Guru Fundamental Report for AAPL - Warren Buffett
2023-03-09 00:00:00,AAPL,How Dependent Is Apple on iPhone Sales? 1 Chart You Need to See
2023-03-09 00:00:00,AAPL,Where Will Apple Stock Be in 1 Year?
2023-03-08 00:00:00,AAPL,Apple to shake up international businesses' management to focus on India - Bloomberg News
2023-03-08 00:00:00,AAPL,"Startup from ex-Apple team raises $100 million, works with OpenAI"
2023-03-07 00:00:00,AAPL,"After Hours Most Active for Mar 7, 2023 : INTC, VALE, LVS, RIVN, LBRT, UBER, GM, CRWD, COMP, WW, AAPL, PLYA"
2023-03-07 00:00:00,AAPL,Is Apple a Safe Stock for 2023?
2023-03-07 00:00:00,AAPL,Apple Unveils Yellow IPhone 14 And IPhone 14 Plus
2023-03-06 00:00:00,AAPL,"After Hours Most Active for Mar 6, 2023 : VALE, BAC, AMZN, QQQ, MRK, AAPL, IQ, MSFT, PFE, KO, ALIT, WDC"
2023-03-06 00:00:00,AAPL,"Time to Buy Apple, Alphabet, or Amazon Stock for More Upside?"
2023-03-06 00:00:00,AAPL,Apple (AAPL) Outpaces Stock Market Gains: What You Should Know
2023-03-06 00:00:00,AAPL,"Dow Movers: BA, AAPL"
2023-03-06 00:00:00,AAPL,"Technology Sector Update for 03/06/2023: RUM, CIEN, AAPL, NVEE"
2023-03-06 00:00:00,AAPL,"Technology Sector Update for 03/06/2023: CIEN, AAPL, NVEE"
2023-03-06 00:00:00,AAPL,Why Apple Stock Popped on Monday
2023-03-06 00:00:00,AAPL,Better Buy: Amazon Stock vs. Apple Stock
2023-03-06 00:00:00,AAPL,"Apple Wants to Part Ways With Broadcom, but It Might Be Very Hard to Do So"
2023-03-04 00:00:00,AAPL,Validea Guru Fundamental Report for AAPL - 3/4/2023
2023-03-03 00:00:00,AAPL,"Dow Movers: TRV, AAPL"
2023-03-03 00:00:00,AAPL,Why Apple Shares Were Higher Today
2023-03-03 00:00:00,AAPL,Apple cloud chief Abbott to step down in April - Bloomberg News
2023-03-03 00:00:00,AAPL,Apple cloud chief Abbott to step down - Bloomberg News
2023-03-03 00:00:00,AAPL,Beyond the iPhone: Here's What May Decide Apple's Future
2023-03-03 00:00:00,AAPL,"Zacks Investment Ideas feature highlights: GameStop, Apple and Bank of America"
2023-03-02 00:00:00,AAPL,"After Hours Most Active for Mar 2, 2023 : BAC, PTON, AI, BHC, TQQQ, UBER, WFC, INFN, CHPT, INTC, AAPL, VIAV"
2023-03-02 00:00:00,AAPL,Apple blocks update to email app with ChatGPT tech - WSJ
2023-03-02 00:00:00,AAPL,April 14th Options Now Available For Apple (AAPL)
2023-03-02 00:00:00,AAPL,2 Major Catalysts for Apple Stock
2023-03-02 00:00:00,AAPL,Could Apple Be the Next Big Tech Company to Make a Move in Healthcare?
2023-03-02 00:00:00,AAPL,"Why Apple, Paramount Global, and Walt Disney Are No-Brainer Buys Right Now"
2023-03-02 00:00:00,AAPL,Apple blocks update to email app with ChatGPT tech - WSJ
2023-03-01 00:00:00,AAPL,"Notable Wednesday Option Activity: AAPL, HD, BIG"
2023-03-01 00:00:00,AAPL,Validea Guru Fundamental Report for AAPL - 3/1/2023
2023-03-01 00:00:00,AAPL,Are Artificial Intelligence Investors Overlooking Apple?
2023-03-01 00:00:00,AAPL,"After Hours Most Active for Mar 1, 2023 : EXEL, AAPL, BABA, CMAX, RADI, CRM, TSLA, GOOGL, TTE, SNOW, ET, GM"
2023-03-01 00:00:00,AAPL,3 Things About Apple That Smart Investors Know
2023-03-01 00:00:00,AAPL,India state launches probe into fire at Apple supplier Foxlink
2023-02-28 00:00:00,AAPL,"The Zacks Analyst Blog Highlights Apple, Linde, Marsh & McLennan Companies, GSK and Expedia"
2023-02-28 00:00:00,AAPL,Apple supplier Foxlink says working to resume production after India fire
2023-02-28 00:00:00,AAPL,"After Hours Most Active for Feb 28, 2023 : VFC, LUMN, WU, COLB, EXC, UMPQ, RIVN, T, AAPL, GGG, LNC, AFRM"
2023-02-28 00:00:00,AAPL,Apple faces EU charge over App Store rules as regulators narrow case
2023-02-28 00:00:00,AAPL,Should Abbott and DexCom Investors Be Worried About Apple's Latest News?
2023-02-28 00:00:00,AAPL,EU antitrust regulators narrow case against Apple
2023-02-28 00:00:00,AAPL,Apple supplier Foxlink had faulty safety equipment at India site hit by fire-official
2023-02-28 00:00:00,AAPL,Apple supplier Foxlink unlikely to resume full India operations for two months-source
2023-02-28 00:00:00,AAPL,Apple supplier Foxlink unlikely to resume full India operations for two months-source
2023-02-28 00:00:00,AAPL,EU Says Apple Breached Antitrust Law In Music-Streaming Case - Quick Facts
2023-02-27 00:00:00,AAPL,Apple pays $12.1 mln fine for alleged app market abuse in Russia - Antimonopoly Service
2023-02-27 00:00:00,AAPL,"After Hours Most Active for Feb 27, 2023 : NU, QQQ, CMCSA, GOOGL, AAPL, KBWB, AMZN, LUMN, OSH, PPL, NEM, COP"
2023-02-27 00:00:00,AAPL,Apple Stock (NASDAQ:AAPL): 2023 Could Be Its Most Exciting Year Yet
2023-02-27 00:00:00,AAPL,Apple supplier Foxlink halts production at Indian facility after massive fire
2023-02-26 00:00:00,AAPL,Better Buy: Apple Stock vs. Disney Stock
2023-02-25 00:00:00,AAPL,Validea Guru Fundamental Report for AAPL - 2/25/2023
2023-02-25 00:00:00,AAPL,A Bull Market Is Coming: 3 Reasons to Buy Apple Stock
2023-02-24 00:00:00,AAPL,Apple Breaks Below 200-Day Moving Average - Notable for AAPL
2023-02-23 00:00:00,AAPL,Apple's Secret Plans to Dominate (Another) $16 Billion Market
2023-02-23 00:00:00,AAPL,"After Hours Most Active for Feb 23, 2023 : PBF, SQ, SBSW, QQQ, CVNA, CSX, LBRT, WDC, AAPL, CTSH, PM, MSFT"
2023-02-23 00:00:00,AAPL,"Apple Takes A Breather, But The Signals Are Clear"
2023-02-22 00:00:00,AAPL,Apple's Chinese contract manufacturer to develop AR device - Nikkei
2023-02-22 00:00:00,AAPL,Apple's Chinese contract manufacturer to develop AR device - Nikkei
2023-02-22 00:00:00,AAPL,Validea Guru Fundamental Report for AAPL - 2/22/2023
2023-02-21 00:00:00,AAPL,Why Apple Stock Tasted Sour on Tuesday
2023-02-21 00:00:00,AAPL,"After Hours Most Active for Feb 21, 2023 : VALE, ITUB, SHV, SHOP, AAPL, PFF, ONEM, AMZN, QQQ, MRO, BAC, NI"
2023-02-21 00:00:00,AAPL,Biden admin won't veto ITC's Apple Watch import ban ruling
2023-02-21 00:00:00,AAPL,Biden admin won't veto ITC's Apple Watch import ban ruling
2023-02-19 00:00:00,AAPL,Validea Daily Guru Fundamental Report for AAPL - 2/19/2023
2023-02-18 00:00:00,AAPL,Best Stock to Buy: Amazon Stock vs. Alphabet Stock vs. Apple Stock
2023-02-18 00:00:00,AAPL,Better Buy: Apple vs. Amazon
2023-02-17 00:00:00,AAPL,"Zacks Value Trader Highlights: Taiwan Semiconductor, Chevron, US Bancorp, Apple and Amazon"
2023-02-17 00:00:00,AAPL,"After Hours Most Active for Feb 17, 2023 : AMCR, KMI, AMZN, OSH, AAPL, WEN, INTC, EIX, QQQ, PPL, SIRI, C"
2023-02-17 00:00:00,AAPL,Validea Daily Guru Fundamental Report for AAPL - 2/17/2023
2023-02-17 00:00:00,AAPL,"Google, Twitter, Meta, Apple face tougher EU online content rules"
2023-02-17 00:00:00,AAPL,Here is What to Know Beyond Why Apple Inc. (AAPL) is a Trending Stock
2023-02-16 00:00:00,AAPL,"After Hours Most Active for Feb 16, 2023 : IEF, AAPL, T, MNTV, DASH, DKNG, TSLA, AMZN, KO, ETWO, PFE, ORCL"
2023-02-16 00:00:00,AAPL,"Zacks Market Edge Highlights: Robinhood, PayPal, Block, Apple and Chewy"
2023-02-15 00:00:00,AAPL,Time to Take a Bite Out of Apple ETFs Following Warren Buffett?
2023-02-15 00:00:00,AAPL,"Technology Sector Update for 02/15/2023: AAPL, TTD, CRDO"
2023-02-15 00:00:00,AAPL,U.S. Justice Department escalates Apple probe - WSJ
2023-02-15 00:00:00,AAPL,"Dow Movers: CVX, AAPL"
2023-02-15 00:00:00,AAPL,"Norwegian payment app Vipps takes on Apple, wants EU antitrust action"
2023-02-15 00:00:00,AAPL,Apple Stock: Headed to $177?
2023-02-14 00:00:00,AAPL,"Notable Tuesday Option Activity: CHPT, AAPL, SNOW"
2023-02-14 00:00:00,AAPL,"After Hours Most Active for Feb 14, 2023 : ITUB, EQRX, ABNB, CSCO, AAPL, FOLD, ABEV, CSX, NU, C, SM, HPQ"
2023-02-14 00:00:00,AAPL,"Why Apple, LVMH, and PepsiCo Are No-Brainer Buys Right Now"
2023-02-14 00:00:00,AAPL,Apple faces obstacles in move to boost India manufacturing - FT
2023-02-14 00:00:00,AAPL,This Semiconductor Stock Has Too Much Dependency on Apple -- Is It Time to Sell?
2023-02-13 00:00:00,AAPL,Validea Daily Guru Fundamental Report for AAPL - 2/13/2023
2023-02-13 00:00:00,AAPL,Why Apple Stock Inched Up by Nearly 2% Today
2023-02-13 00:00:00,AAPL,1 Billion Reasons to Love Apple Stock
2023-02-13 00:00:00,AAPL,"After Hours Most Active for Feb 13, 2023 : PLTR, AEHA, AMD, BEKE, AMZN, AAPL, CSCO, INTC, BAC, IBN, VZ, T"
2023-02-13 00:00:00,AAPL,"Apple supplier Salcomp to boost Indian workforce to 25,000"
2023-02-13 00:00:00,AAPL,"Apple supplier Salcomp to more than double Indian workforce to 25,000"
2023-02-12 00:00:00,AAPL,Where Will Apple Stock Be in 3 Years?
2023-02-12 00:00:00,AAPL,Is It Too Late to Buy Apple Stock?
2023-02-12 00:00:00,AAPL,This 1 Key Figure Shows Apple Stock's Growth Potential
2023-02-10 00:00:00,AAPL,"After Hours Most Active for Feb 10, 2023 : IGSB, PBR, ITUB, CLVT, FTXG, AAPL, IQ, FTSM, PFE, RLJ, DAL, AMZN"
2023-02-10 00:00:00,AAPL,"Apple to defend mobile payment system at Feb. 14 EU hearing, sources say"
2023-02-10 00:00:00,AAPL,"MGK, AAPL, MSFT, CRM: Large Inflows Detected at ETF"
2023-02-10 00:00:00,AAPL,Better Growth Stock: Nvidia vs. Apple
2023-02-10 00:00:00,AAPL,China's Economic Reopening Is Boosting Sales for Apple and Easing Supply Chain Constraints
2023-02-09 00:00:00,AAPL,"After Hours Most Active for Feb 9, 2023 : ABEV, PBR, LYFT, INTC, CLVT, MSFT, SNAP, AAPL, GOOGL, AMZN, GMED, T"
2023-02-09 00:00:00,AAPL,Smartphone Sales Are Peaking. Here's Why Apple Doesn't Really Care
2023-02-09 00:00:00,AAPL,This Is Retail Investors' Favorite Stock to Own (and It's Not Apple or a Meme Stock)
2023-02-08 00:00:00,AAPL,Apple Forecast: My AAPL Stock Price Prediction for 2025
2023-02-08 00:00:00,AAPL,"After Hours Most Active for Feb 8, 2023 : RF, AFRM, KBWB, DIS, MSFT, QQQ, LBRT, AAPL, HOOD, AES, MRO, C"
2023-02-08 00:00:00,AAPL,"Schibsted, publishers look to EU tech rules to resolve Apple antitrust concerns"
2023-02-08 00:00:00,AAPL,Apple Revenue Declines for the First Time Since 2019. Time to Sell?
2023-02-08 00:00:00,AAPL,"Why Apple, Microsoft, and Warner Bros. Discovery Stocks are No-Brainer Buys Right Now"
2023-02-08 00:00:00,AAPL,Better Buy: Tesla vs. Apple
2023-02-07 00:00:00,AAPL,"Apple's Stock Is Resilient, but Business Is Not Immune to Macro Headwinds"
2023-02-07 00:00:00,AAPL,BlackRock Increases Position in Apple (AAPL)
2023-02-07 00:00:00,AAPL,"Notable Tuesday Option Activity: COST, ENPH, AAPL"
2023-02-07 00:00:00,AAPL,Will Apple Learn From Meta's Virtual Reality Mistakes?
2023-02-06 00:00:00,AAPL,A Rare Earnings Miss Couldn’t Stop Apple Stock (NASDAQ:AAPL)
2023-02-06 00:00:00,AAPL,See Which Of The Latest 13F Filers Holds Apple
2023-02-06 00:00:00,AAPL,Validea Daily Guru Fundamental Report for AAPL - 2/6/2023
2023-02-06 00:00:00,AAPL,"Has a New Bull Market Begun? (AAPL, AMZN, TSLA, META)"
2023-02-06 00:00:00,AAPL,Buying This Fund Is Like Buying Apple With a 12.1% Dividend
2023-02-06 00:00:00,AAPL,Apple: What's The Post-Earnings Play?
2023-02-06 00:00:00,AAPL,Is Trending Stock Apple Inc. (AAPL) a Buy Now?
2023-02-06 00:00:00,AAPL,"Amazon, Alphabet, Apple, Meta and Microsoft are part of Zacks Earnings Preview"
2023-02-04 00:00:00,AAPL,Apple (AAPL) Declares $0.23 Dividend
2023-02-03 00:00:00,AAPL,"Apple Earnings Miss, But the Stock Rallies Anyway"
2023-02-03 00:00:00,AAPL,Why Apple Stock Gained 11% in January
2023-02-03 00:00:00,AAPL,"Technology Sector Update for 02/03/2023: ITI, GOOG, GOOGL, AAPL, AI"
2023-02-03 00:00:00,AAPL,ETFs in Focus on Apple's First Earnings Miss Since 2016
2023-02-03 00:00:00,AAPL,"Daily Dividend Report: MCD,AAPL,GILD,MCHP,APH"
2023-02-03 00:00:00,AAPL,"Apple (AAPL) Q1 Earnings Miss Estimates, Revenues Decline Y/Y"
2023-02-03 00:00:00,AAPL,Why Apple Stock Was Up on Friday
2023-02-03 00:00:00,AAPL,"Making Sense of Apple, Amazon and Big Tech Earnings"
2023-02-03 00:00:00,AAPL,"Pre-Market Most Active for Feb 3, 2023 : TQQQ, SQQQ, TSLA, GRCL, AAPL, BBBY, JWN, F, CVNA, APE, NIO, SI"
2023-02-03 00:00:00,AAPL,Apple Stock Falls After Earnings
2023-02-03 00:00:00,AAPL,Here's What Key Metrics Tell Us About Apple (AAPL) Q1 Earnings
2023-02-02 00:00:00,AAPL,Apple (AAPL) Misses Q1 Earnings and Revenue Estimates
2023-02-02 00:00:00,AAPL,"Apple Inc. Q1 Profit Drops, misses estimates"
2023-02-02 00:00:00,AAPL,"After-Hours Earnings Report for February 2, 2023 : AAPL, AMZN, GOOG, GOOGL, QCOM, SBUX, GILD, F, MCHP, CTSH, DB, TEAM"
2023-02-02 00:00:00,AAPL,Apple (AAPL) Q1 2023 Earnings Call Transcript
2023-02-02 00:00:00,AAPL,"After Hours Most Active for Feb 2, 2023 : AMZN, F, QQQ, AAPL, SQQQ, TQQQ, GOOGL, ABEV, ITUB, IBN, C, WFC"
2023-02-02 00:00:00,AAPL,Apple's lower iPhone sales drive first profit miss since 2016
2023-02-02 00:00:00,AAPL,Apple (AAPL) Q1 2023 Earnings: What to Expect
2023-02-02 00:00:00,AAPL,"Noteworthy ETF Inflows: SPGM, AAPL, MSFT, AMZN"
2023-02-02 00:00:00,AAPL,Apple Q1 23 Earnings Conference Call At 5:00 PM ET
2023-02-02 00:00:00,AAPL,"Democratic senator urges Apple, Google to kick TikTok out of app stores"
2023-02-01 00:00:00,AAPL,PREVIEW-Apple set to post rare revenue drop as focus shifts to demand rebound
2023-02-01 00:00:00,AAPL,Will Slowing Services Growth Hurt Apple's (AAPL) Q1 Earnings?
2023-02-01 00:00:00,AAPL,"META, AAPL, AMZN Predictions: 3 Hot Stocks for Tomorrow"
2023-02-01 00:00:00,AAPL,Could Apple Stock Help You Become a Millionaire?
2023-02-01 00:00:00,AAPL,"The Zacks Analyst Blog Highlights Apple, Meta Platforms, Mastercard, CVS Health and Ameriprise Financial"
2023-02-01 00:00:00,AAPL,Apple distributor Redington's Q3 profit falls as costs outpace topline growth
2023-01-31 00:00:00,AAPL,Apple (AAPL) to Report Q1 Earnings: What's in the Offing?
2023-01-31 00:00:00,AAPL,Big Tech Earnings Preview: Time to Buy Apple Stock?
2023-01-31 00:00:00,AAPL,"After Hours Most Active for Jan 31, 2023 : C, SNAP, HBAN, EMBC, OPEN, AAPL, PPL, PARA, AMD, BAC, PFE, AMCR"
2023-01-31 00:00:00,AAPL,"Apple workplace rules violate U.S. labor law, agency finds"
2023-01-31 00:00:00,AAPL,"Q4 Earnings Season Scorecard and Analyst Reports for Apple, Meta & Mastercard"
2023-01-31 00:00:00,AAPL,Validea Daily Guru Fundamental Report for AAPL - 1/31/2023
2023-01-31 00:00:00,AAPL,Better Tech Stock in 2023: Apple vs. AMD
2023-01-31 00:00:00,AAPL,Apple Could Teach Fellow Top Warren Buffett Stock Chevron a Valuable Lesson
2023-01-31 00:00:00,AAPL,Apple Just Laid the Groundwork for Its Next Multibillion-Dollar Opportunity
2023-01-30 00:00:00,AAPL,Apple Earnings Preview: Why AAPL Stock Could Dive After the Feb. 2 Report
2023-01-30 00:00:00,AAPL,"Unusual Options Activity: COIN, LCID, AAPL and 6 Others"
2023-01-30 00:00:00,AAPL,"After Hours Most Active for Jan 30, 2023 : ET, AAPL, DV, MPLX, CLVT, OPEN, MSFT, BBAI, GOOGL, QQQ, AMZN, RFP"
2023-01-30 00:00:00,AAPL,Time to Take Another Bite of Apple Before Q1 Earnings?
2023-01-30 00:00:00,AAPL,"Notable Monday Option Activity: AAPL, CMRE, FSR"
2023-01-30 00:00:00,AAPL,"Amazon, Alphabet, Apple, Intel and Microsoft are part of Zacks Earnings Preview"
2023-01-30 00:00:00,AAPL,Why Apple Is Poised For A Tough Holiday Quarter
2023-01-30 00:00:00,AAPL,Apple's India supplier Jabil making AirPods parts for export-Bloomberg
2023-01-29 00:00:00,AAPL,"Weekly Preview: Earnings To Watch This Week 1-29-23 (AAPL, AMZN, GOOG, META)"
2023-01-28 00:00:00,AAPL,Big Banks Try to Take On Apple Wallet and PayPal
2023-01-27 00:00:00,AAPL,"After Hours Most Active for Jan 27, 2023 : PAA, QQQ, EPD, SNOW, LCID, TSLA, CCL, AAPL, AMZN, CVE, WFC, WES"
2023-01-27 00:00:00,AAPL,"Zacks Investment Ideas feature highlights: Chevron, Kinder Morgan, Agilent Technologies, Apple and Microsoft"
2023-01-26 00:00:00,AAPL,Earnings Preview: Apple (AAPL) Q1 Earnings Expected to Decline
2023-01-26 00:00:00,AAPL,U.S. lawsuit against Google could benefit Apple and others
2023-01-26 00:00:00,AAPL,Apple Reports After the Close on 2/2 -- Options Contracts Expire the Next Day
2023-01-26 00:00:00,AAPL,U.S. lawsuit against Google could benefit Apple and others
2023-01-26 00:00:00,AAPL,Does This VR News Make Apple Stock a Buy for 2023?
2023-01-26 00:00:00,AAPL,Apple Earnings Preview: Time to Buy AAPL Stock?
2023-01-26 00:00:00,AAPL,"After Hours Most Active for Jan 26, 2023 : ACWI, AAPL, GEO, ARMK, YEXT, AMD, FOLD, SYF, MTG, UBER, AMZN, WBD"
2023-01-26 00:00:00,AAPL,What Does Apple's Move to India Mean for Investors?
2023-01-25 00:00:00,AAPL,Zacks Investment Ideas feature highlights: Amazon and Apple
2023-01-25 00:00:00,AAPL,Interesting AAPL Put And Call Options For December 2025
2023-01-25 00:00:00,AAPL,"Notable ETF Outflow Detected - ITOT, AAPL, MSFT, AMZN"
2023-01-25 00:00:00,AAPL,"After Hours Most Active for Jan 25, 2023 : TSLA, GOOG, C, WIT, AAPL, TQQQ, IOVA, ALT, CLVT, DAL, AES, KMI"
2023-01-25 00:00:00,AAPL,Better Buy in 2023: Apple Stock vs. Disney Stock
2023-01-25 00:00:00,AAPL,"Apple's Chip Strategy Is Great News for Shareholders, Bad News for Skyworks, Broadcom, and Qualcomm"
2023-01-24 00:00:00,AAPL,"The Zacks Analyst Blog Highlights Apple, Microsoft, Meta Platforms, Alphabet and NVIDIA"
2023-01-24 00:00:00,AAPL,"The Zacks Analyst Blog Highlights Microsoft, Tesla, Apple and Alphabet"
2023-01-23 00:00:00,AAPL,Why Apple Stock Was Climbing Today
2023-01-23 00:00:00,AAPL,"Apple in talks with Disney, others on VR content for new headset - Bloomberg News"
2023-01-23 00:00:00,AAPL,"Notable Monday Option Activity: SBUX, AAPL, COST"
2023-01-23 00:00:00,AAPL,Why Apple (AAPL) is Poised to Beat Earnings Estimates Again
2023-01-23 00:00:00,AAPL,"Apple Wants To Make 25% Of Its IPhones In India, Minister Says"
2023-01-23 00:00:00,AAPL,"After Hours Most Active for Jan 23, 2023 : BBD, NOK, ITUB, ARMK, TEVA, CCL, QQQ, FOLD, STNE, AAPL, CMCSA, ACWI"
2023-01-23 00:00:00,AAPL,Is Most-Watched Stock Apple Inc. (AAPL) Worth Betting on Now?
2023-01-23 00:00:00,AAPL,Why Warren Buffett Wants Apple Stock to Tumble
2023-01-23 00:00:00,AAPL,Will Apple Stock Beat the Market in 2023?
2023-01-23 00:00:00,AAPL,Apple targets raising India production share to up to 25% - minister
2023-01-22 00:00:00,AAPL,Apple Announces New Chips -- Should Semiconductor Companies Worry?
2023-01-22 00:00:00,AAPL,This Oil Stock Is Beating Apple at Its Own Game
2023-01-20 00:00:00,AAPL,Apple appeals investigation by UK competition watchdog
2023-01-20 00:00:00,AAPL,Validea Daily Guru Fundamental Report for AAPL - 1/20/2023
2023-01-20 00:00:00,AAPL,Apple wins appeal to keep $308 million U.S. patent verdict at bay
2023-01-20 00:00:00,AAPL,"After Hours Most Active for Jan 20, 2023 : WY, CSX, AAPL, BAC, AMZN, GILD, CL, ADM, BEKE, AFL, TLT, MSFT"
2023-01-20 00:00:00,AAPL,Didi Global's ride-hailing app back on Apple app stores in China
2023-01-20 00:00:00,AAPL,Apple Stock: Bull vs. Bear
2023-01-20 00:00:00,AAPL,The Global Smartphone Market Just Fell Off a Cliff. Apple Beat the Odds.
2023-01-19 00:00:00,AAPL,Apple Stock Is Down 25% From Its High. Time to Buy?
2023-01-19 00:00:00,AAPL,Better Buy: Apple Stock vs. Disney Stock
2023-01-19 00:00:00,AAPL,Best Stock to Buy: Amazon Stock vs. Apple Stock
2023-01-18 00:00:00,AAPL,AAPL September 2024 Options Begin Trading
2023-01-18 00:00:00,AAPL,"After Hours Most Active for Jan 18, 2023 : VONG, IGSB, BK, UBER, NYCB, AAPL, BAC, PYPL, INTC, IBN, AQN, QQQ"
2023-01-18 00:00:00,AAPL,Better Buy in 2023: Apple Stock vs. Amazon Stock
2023-01-18 00:00:00,AAPL,Bloomberg: Apple To Focus On Developing Mixed-reality Headset Instead Of Augmented Reality Glasses
2023-01-18 00:00:00,AAPL,Spotify joins media firms to urge EU action against Apple's 'unfair' practices
2023-01-18 00:00:00,AAPL,"In a Stunning Move, Apple Plans to Ditch Highly Valued Wireless Component Suppliers"
2023-01-17 00:00:00,AAPL,Apple (AAPL) Gains As Market Dips: What You Should Know
2023-01-17 00:00:00,AAPL,"After Hours Most Active for Jan 17, 2023 : UAL, GOOGL, SU, ATCO, MSFT, DIS, TSLA, AMZN, AAPL, RIG, T, VICI"
2023-01-17 00:00:00,AAPL,Dow Analyst Moves: AAPL
2023-01-17 00:00:00,AAPL,Apple Unveils New MacBook Pro Powered By M2 Pro And M2 Max Chips
2023-01-17 00:00:00,AAPL,Should Investors Bite Into Apple (AAPL) Stock?
2023-01-17 00:00:00,AAPL,Apple supplier Foxconn replaces iPhone business chief- Bloomberg News
2023-01-17 00:00:00,AAPL,"Apple launches new macbooks, Mac mini in rare January launch"
2023-01-16 00:00:00,AAPL,Apple supplier Foxconn replaces iPhone business chief- Bloomberg News
2023-01-16 00:00:00,AAPL,Better Growth Stock in 2023: Apple vs. AMD
2023-01-16 00:00:00,AAPL,"The Zacks Analyst Blog Highlights Lenovo Group, HP, Dell Technologies and Apple"
2023-01-16 00:00:00,AAPL,"Zacks Value Trader Highlights: Berkshire Hathaway, Apple, Bank of America, Chevron, The Coca-Cola"
2023-01-14 00:00:00,AAPL,281 Billion Reasons Why You May Regret Not Buying Apple Stock
2023-01-13 00:00:00,AAPL,"Notable Friday Option Activity: AAPL, COST, SBUX"
2023-01-13 00:00:00,AAPL,Is It the Right Time to Buy Apple Stock?
2023-01-13 00:00:00,AAPL,"Technology Sector Update for 01/13/2023: ATOM, SATX, AAPL, XLK, SOXX"
2023-01-13 00:00:00,AAPL,Apple Is Reportedly Designing Chips to Cut Broadcom Out of the Mix -- Time to Sell Broadcom Stock?
2023-01-12 00:00:00,AAPL,AAPL March 3rd Options Begin Trading
2023-01-12 00:00:00,AAPL,Why Apple Is My Favorite Big Tech Stock Right Now
2023-01-12 00:00:00,AAPL,Apple CEO Cook's pay more dependent on stock performance in 2023
2023-01-12 00:00:00,AAPL,The Apple and Meta Battle Is Moving to the Metaverse
2023-01-12 00:00:00,AAPL,3 Reasons to Buy Apple Stock in 2023
2023-01-11 00:00:00,AAPL,Is Apple a Screaming Buy Right Now?
2023-01-11 00:00:00,AAPL,"After Hours Most Active for Jan 11, 2023 : BEKE, GOOG, KGC, BBBY, C, GERN, AAPL, BLUE, AMZN, MRO, BAC, FIS"
2023-01-11 00:00:00,AAPL,Apple may add touch screens to Mac computers - Bloomberg News
2023-01-11 00:00:00,AAPL,"Technology Sector Update for 01/11/2023: VSAT,BA,MASI,AAPL,ENTG"
2023-01-11 00:00:00,AAPL,"Technology Sector Update for 01/11/2023: MASI,AAPL,ENTG"
2023-01-11 00:00:00,AAPL,Apple Is Making a Headset. Is It a Game Changer?
2023-01-11 00:00:00,AAPL,Masimo (MASI) Gets Favorable Ruling in Apple Watch Patent Suit
2023-01-11 00:00:00,AAPL,"Health Care Sector Update for 01/11/2023: BIOR, MASI, AAPL, AXNX, XLV, IBB"
2023-01-11 00:00:00,AAPL,Apple's (AAPL) Plan to Use Homegrown Chips to Hurt Suppliers
2023-01-10 00:00:00,AAPL,1 Green Flag and 1 Red Flag for Apple Stock in 2023
