Date,Stock_symbol,Article_title
2023-12-16 22:00:00,AAPL,Brokers Suggest Investing in Apple (AAPL): Read This Before Placing a Bet
2023-12-16 21:00:00,AAPL,"Pre-Market Most Active for Dec 19, 2023 : BMY, SQQQ, NIO, UBS, TQQQ, UBER, NVDA, AAPL, GOTU, CAN, TSLA, PLTR"
2023-12-16 20:00:00,AAPL,AAPL Quantitative Stock Analysis
2023-12-16 04:00:00,AAPL,"After Hours Most Active for Dec 18, 2023 : PACB, AAPL, VTIP, EDAP, FTNT, AMZN, HPE, SKT, VZ, MRK, BVN, PFE"
2023-12-16 04:00:00,AAPL,"Technology Sector Update for 12/18/2023: PCT, ADBE, AAPL, EBIX"
2023-12-16 04:00:00,AAPL,Apple To Halt Sale Of Watch Series 9 And Ultra 2
2023-12-16 02:00:00,AAPL,"Technology Sector Update for 12/18/2023: ADBE, AAPL, EBIX"
2023-12-16 00:00:00,AAPL,FOCUS-Goldman Sachs faces rocky exit from Apple credit card partnership
2023-12-16 00:00:00,AAPL,"Apple to halt US sales of Series 9, Ultra 2 smartwatches on patent dispute"
2023-12-16 00:00:00,AAPL,This Is Apple's Most Important Growth Product Today (Hint: It's Not the iPhone)
2023-12-15 00:00:00,AAPL,Will Nvidia Be Worth More Than Apple by 2030?
2023-12-15 00:00:00,AAPL,Guru Fundamental Report for AAPL
2023-12-14 00:00:00,AAPL,China's ban on Apple's iPhone accelerates- Bloomberg News
2023-12-14 00:00:00,AAPL,"After Hours Most Active for Dec 15, 2023 : UBER, LCID, PFE, KO, AAPL, PCG, EBAY, ALK, MSFT, SEE, CSCO, XP"
2023-12-13 00:00:00,AAPL,"Zacks Investment Ideas feature highlights: Tesla, Apple and Rivian"
2023-12-13 00:00:00,AAPL,"The Zacks Analyst Blog Highlights Salesforce, Intel, Microsoft, Apple and Boeing"
2023-12-13 00:00:00,AAPL,"Apple sued with Visa, Mastercard in card-fee antitrust case"
2023-12-13 00:00:00,AAPL,Validea Detailed Fundamental Analysis - AAPL
2023-12-13 00:00:00,AAPL,Best Stock to Buy: Apple vs. Coca-Cola
2023-12-13 00:00:00,AAPL,Will Apple Stock Reign Supreme Yet Again in 2024?
2023-12-13 00:00:00,AAPL,"Technology Sector Update for 12/14/2023: ADBE, MVIS, AAPL, GOOG"
2023-12-13 00:00:00,AAPL,Apple (AAPL) Advances But Underperforms Market: Key Facts
2023-12-13 00:00:00,AAPL,"Earnings Season Update and Analyst Reports for Apple, Bank of America & S&P Global"
2023-12-13 00:00:00,AAPL,MSFT vs. AAPL: Which Stock Has More AI Upside Potential?
2023-12-12 00:00:00,AAPL,US STOCKS-Wall St rises on Fed's rate-cut signal; Apple scales record high
2023-12-12 00:00:00,AAPL,Where Will Apple Stock Be in 5 Years?
2023-12-12 00:00:00,AAPL,"EU asks Apple, Google to clarify app store risk management"
2023-12-12 00:00:00,AAPL,Zacks Investment Ideas feature highlights: Apple
2023-12-12 00:00:00,AAPL,Apple reaches record high close as Fed signals rate cuts
2023-12-12 00:00:00,AAPL,Guru Fundamental Report for AAPL
2023-12-12 00:00:00,AAPL,"Technology Sector Update for 12/13/2023: AAPL, TTWO, META"
2023-12-12 00:00:00,AAPL,Time for Apple ETFs on Optimism for Holiday Season & Beyond?
2023-12-12 00:00:00,AAPL,Apple Nears All-Time High: Is the Tech Giant Too Extended?
2023-12-12 00:00:00,AAPL,Is Apple Stock a Buy Now?
2023-12-12 00:00:00,AAPL,Apple Inc. (AAPL) Is a Trending Stock: Facts to Know Before Betting on It
2023-12-12 00:00:00,AAPL,AAPL Quantitative Stock Analysis
2023-12-12 00:00:00,AAPL,"After Hours Most Active for Dec 13, 2023 : RIVN, T, TLT, PM, CIM, NRDY, F, AMZN, MO, AAPL, MRTX, QQQ"
2023-12-12 00:00:00,AAPL,"EXCLUSIVE-Apple offers to let rivals access tap-and-go tech in EU antitrust case, sources say"
2023-12-12 00:00:00,AAPL,"1 Unstoppable Stock Set to Join Apple, Microsoft, Amazon, Alphabet, and Nvidia in the $1 Trillion Club in 2024"
2023-12-11 00:00:00,AAPL,Here’s What to Expect From Apple Stock in 2024
2023-12-11 00:00:00,AAPL,AAPL Factor-Based Stock Analysis
2023-12-11 00:00:00,AAPL,Apple to be hit by EU antitrust order in fight with Spotify - Bloomberg News
2023-12-11 00:00:00,AAPL,"After Hours Most Active for Dec 12, 2023 : AAPL, HST, CRH, COTY, MSFT, CCCC, BMY, QQQ, BAC, COMP, CMCSA, F"
2023-12-11 00:00:00,AAPL,"Technology Sector Update for 12/12/2023: AAPL, ORCL, GOOG, NVEE"
2023-12-11 00:00:00,AAPL,Apple now requires a judge's consent to hand over push notification data
2023-12-11 00:00:00,AAPL,"After Hours Most Active for Dec 11, 2023 : CXM, INTC, PTEN, AMZN, SABR, ORCL, BMY, AAPL, CNHI, BEKE, WFC, KHC"
2023-12-11 00:00:00,AAPL,"Notable Monday Option Activity: PAR, SABR, AAPL"
2023-12-11 00:00:00,AAPL,Could Apple Stock Plummet in 2024?
2023-12-10 00:00:00,AAPL,"1 Artificial Intelligence (AI) Stock Set to Join Apple, Amazon, Microsoft, Alphabet, and Nvidia in the $1 Trillion Club"
2023-12-10 00:00:00,AAPL,Guru Fundamental Report for AAPL
2023-12-08 00:00:00,AAPL,Apple (AAPL) Rises Higher Than Market: Key Facts
2023-12-08 00:00:00,AAPL,Apple's iPhone and watch design head to depart in February - Bloomberg News
2023-12-08 00:00:00,AAPL,Best Stock to Buy: Apple vs. Shopify
2023-12-08 00:00:00,AAPL,Validea Detailed Fundamental Analysis - AAPL
2023-12-08 00:00:00,AAPL,Apple to move key iPad engineering resources to Vietnam- Nikkei
2023-12-07 00:00:00,AAPL,Apple-backed study finds rise in data breaches as iPhone maker defends encryption stance
2023-12-07 00:00:00,AAPL,Ex-Apple lawyer sentenced to probation for insider trading
2023-12-07 00:00:00,AAPL,"Tesla's Dojo supercomputer head leaves, former Apple exec to lead - Bloomberg News"
2023-12-07 00:00:00,AAPL,"Dow Movers: MRK, AAPL"
2023-12-07 00:00:00,AAPL,Guru Fundamental Report for AAPL
2023-12-07 00:00:00,AAPL,Best Stock to Buy: Apple vs. Amazon
2023-12-07 00:00:00,AAPL,AAPL Stock Outlook : Don’t Be Scared by the Noise
2023-12-07 00:00:00,AAPL,"Zacks Industry Outlook Highlights Apple, HP and 3D Systems"
2023-12-07 00:00:00,AAPL,"Apple at a $3 Trillion Market Cap: Buy, Sell, or Hold?"
2023-12-06 00:00:00,AAPL,Apple Regains $3T in Market Cap: ETFs in Focus
2023-12-06 00:00:00,AAPL,"Governments spying on Apple, Google users through push notifications -US senator"
2023-12-06 00:00:00,AAPL,AAPL Factor-Based Stock Analysis
2023-12-06 00:00:00,AAPL,"After Hours Most Active for Dec 6, 2023 : CCI, CHWY, BEKE, CNHI, AEO, BABA, QQQ, INTC, AAPL, GOOGL, PARA, MTCH"
2023-12-06 00:00:00,AAPL,"Decoding Apple’s Stock Trajectory: Time to Buy, Hold, or Sell AAPL?"
2023-12-06 00:00:00,AAPL,Apple told component suppliers to source iPhone 16 batteries from India- FT
2023-12-06 00:00:00,AAPL,Apple (NASDAQ:AAPL) Stock Reclaims $3 Trillion Market Cap; What Comes Next?
2023-12-06 00:00:00,AAPL,TipRanks All-Star Analyst – Who is the Best on AAPL Stock? 
2023-12-05 00:00:00,AAPL,"Dow Movers: PG, AAPL"
2023-12-05 00:00:00,AAPL,Why Apple Stock Gained 11% in November
2023-12-05 00:00:00,AAPL,"After Hours Most Active for Dec 5, 2023 : MRK, CRH, CNHI, MTCH, AAPL, SCPH, ABR, CMCSA, INBX, CSCO, SYF, HPQ"
2023-12-05 00:00:00,AAPL,"Nasdaq 100 Movers: PYPL, AAPL"
2023-12-05 00:00:00,AAPL,AAPL Quantitative Stock Analysis
2023-12-05 00:00:00,AAPL,Will Microsoft Overtake Apple as the World's Largest Company in 2024?
2023-12-05 00:00:00,AAPL,EXCLUSIVE-Apple warns India's EU-style charger rules will hit local production target
2023-12-04 00:00:00,AAPL,"Noteworthy Monday Option Activity: MRNA, AAPL, GOOGL"
2023-12-04 00:00:00,AAPL,2 Reasons to Buy Apple Stock Like There's No Tomorrow
2023-12-04 00:00:00,AAPL,"Buying Apple Stock Is a Smart Move, Only if This 1 Thing Happens"
2023-12-03 00:00:00,AAPL,"After Soaring in 2023, Is Apple a Smart Stock to Buy in 2024?"
2023-12-03 00:00:00,AAPL,Apple Is Far Less Important to Berkshire Hathaway Than You Think
2023-12-03 00:00:00,AAPL,Guru Fundamental Report for AAPL
2023-12-03 00:00:00,AAPL,"Apple Stock: Buy, Sell, or Hold?"
2023-12-03 00:00:00,AAPL,A Bull Market Could Be Here: 3 Reasons to Buy Apple Stock
2023-12-01 00:00:00,AAPL,1 Glaring Risk for Apple Stock Investors That Just Got More Concerning
2023-12-01 00:00:00,AAPL,Validea Detailed Fundamental Analysis - AAPL
2023-12-01 00:00:00,AAPL,WSJ: Apple In Talks To Bundle Paramount+ With Apple TV+
2023-12-01 00:00:00,AAPL,"Apple, Paramount discuss bundling their streaming services - WSJ"
2023-12-01 00:00:00,AAPL,CMA Wins Appeal From UK High Court In Apple Case
2023-12-01 00:00:00,AAPL,Apple To Be First And Largest Customer Of Amkor's $2 Bln Chip Packaging Plant
2023-11-30 00:00:00,AAPL,UK antitrust regulator wins appeal over Apple probe
2023-11-30 00:00:00,AAPL,Guru Fundamental Report for AAPL
2023-11-29 00:00:00,AAPL,"Financial Sector Update for 11/29/2023: PACI, GS, AAPL, BRK.A, BRK.B"
2023-11-29 00:00:00,AAPL,Goldman (GS) Gets Exit Proposal From Apple on Consumer Business
2023-11-29 00:00:00,AAPL,AAPL Factor-Based Stock Analysis
2023-11-29 00:00:00,AAPL,Apple’s 2024 Outlook: Why Holding This ‘Magnificent Seven’ Stock Is a Smart Move
2023-11-28 00:00:00,AAPL,AAPL Quantitative Stock Analysis
2023-11-28 00:00:00,AAPL,Apple to end credit-card partnership with Goldman Sachs - WSJ
2023-11-28 00:00:00,AAPL,Apple to end credit-card partnership with Goldman Sachs - WSJ
2023-11-28 00:00:00,AAPL,Investors Heavily Search Apple Inc. (AAPL): Here is What You Need to Know
2023-11-28 00:00:00,AAPL,"Apple Stock: Buy, Sell, or Hold?"
2023-11-28 00:00:00,AAPL,"Apple Has Big Changes Planned for Next Year, and They Should Make Messaging to Android Devices a Lot Easier"
2023-11-28 00:00:00,AAPL,Is Apple an Underrated AI Stock to Buy Right Now?
2023-11-27 00:00:00,AAPL,"Australia to amend law to regulate digital payments like Apple, Google Pay"
2023-11-26 00:00:00,AAPL,Guru Fundamental Report for AAPL
2023-11-25 00:00:00,AAPL,"AAPL, AMZN, or NVDA: Which “Strong Buy” Mega-Cap Tech Stock Could Deliver the Best Returns?"
2023-11-24 00:00:00,AAPL,"After Hours Most Active for Nov 24, 2023 : TV, PCG, TLT, BXSL, AAPL, QQQ, PTEN, LIVN, AMZN, AVNT, T, CLVT"
2023-11-24 00:00:00,AAPL,Apple (AAPL) Expands Streaming Content for Holiday Season
2023-11-24 00:00:00,AAPL,Validea Detailed Fundamental Analysis - AAPL
2023-11-23 00:00:00,AAPL,The Next Tech Battlefield: Apple’s Position in the Emerging AI Landscape
2023-11-23 00:00:00,AAPL,"Apple's (AAPL) iPhone 15 Hit in South Korea, Lags in China"
2023-11-23 00:00:00,AAPL,Guru Fundamental Report for AAPL
2023-11-23 00:00:00,AAPL,"Volume of Apple sales underperforms Huawei, Xiaomi on China's Singles Day - data"
2023-11-23 00:00:00,AAPL,"Value of Apple sales underperforms Huawei, Xiaomi on China's Singles Day - data"
2023-11-22 00:00:00,AAPL,AAPL Factor-Based Stock Analysis
2023-11-22 00:00:00,AAPL,Apple Stock (NASDAQ:AAPL): Can Siri Keep Up in the ChatGPT Age?
2023-11-21 00:00:00,AAPL,AAPL Quantitative Stock Analysis
2023-11-21 00:00:00,AAPL,"Apple (NASDAQ:AAPL): Boring, But Commands Massive Pricing Power"
2023-11-21 00:00:00,AAPL,3 Reasons to Buy AAPL Stock Even After Its Fourth Consecutive Sales Decline
2023-11-20 00:00:00,AAPL,"Venmo, Cash App users sue Apple over peer-to-peer payment fees"
2023-11-20 00:00:00,AAPL,"Up 45% Since The Beginning Of 2023, Where Is Apple Stock Headed?"
2023-11-20 00:00:00,AAPL,Dow Analyst Moves: AAPL
2023-11-19 00:00:00,AAPL,Apple's Secretly a Digital Advertising Giant Bringing in Tens of Billions in Revenue
2023-11-19 00:00:00,AAPL,Guru Fundamental Report for AAPL
2023-11-18 00:00:00,AAPL,Is Apple Stock a Buy Now?
2023-11-18 00:00:00,AAPL,3 Reasons to Buy Apple and 1 Reason to Sell
2023-11-17 00:00:00,AAPL,"After Hours Most Active for Nov 17, 2023 : MMM, QQQ, MATV, AAPL, NU, VCSH, MSFT, STRO, AMZN, KEY, VZ, BAC"
2023-11-17 00:00:00,AAPL,"Noteworthy Friday Option Activity: EXPE, AAPL, AMZN"
2023-11-17 00:00:00,AAPL,"IVV, AAPL, MSFT, AMZN: ETF Inflow Alert"
2023-11-17 00:00:00,AAPL,Could Apple Stock Make You Rich?
2023-11-17 00:00:00,AAPL,Here is What to Know Beyond Why Apple Inc. (AAPL) is a Trending Stock
2023-11-17 00:00:00,AAPL,Validea Detailed Fundamental Analysis - AAPL
2023-11-17 00:00:00,AAPL,"Zacks Investment Ideas feature highlights: Lululemon, Apple, Tesla, Novo Nordisk and DraftKings"
2023-11-16 00:00:00,AAPL,July 2024 Options Now Available For Apple
2023-11-16 00:00:00,AAPL,Apple to make messaging between iPhones and Androids easier - Bloomberg News
2023-11-16 00:00:00,AAPL,Guru Fundamental Report for AAPL
2023-11-15 00:00:00,AAPL,AAPL Stock: Is the Magic Gone? Here’s How You Can Still Profit
2023-11-15 00:00:00,AAPL,US lawmakers question Apple over Jon Stewart's China content
2023-11-15 00:00:00,AAPL,"After Hours Most Active for Nov 15, 2023 : NEM, CSCO, BK, FIS, V, PFE, AAPL, VZ, QQQ, VONG, SQQQ, AMZN"
2023-11-15 00:00:00,AAPL,AAPL Factor-Based Stock Analysis
2023-11-15 00:00:00,AAPL,Apple's iPhone 14 users get another year of free satellite SOS access
2023-11-15 00:00:00,AAPL,Better Buy: Amazon vs. Apple
2023-11-15 00:00:00,AAPL,US lawmakers question Apple over Jon Stewart's China content
2023-11-15 00:00:00,AAPL,Forget Apple: These 2 Stocks Are Better Buys for a Bull Market
2023-11-14 00:00:00,AAPL,"Pre-Market Most Active for Nov 14, 2023 : THRX, AAPL, PLTR, SQQQ, AMD, TSLA, TQQQ, BMY, SE, ONON, NIO, KO"
2023-11-14 00:00:00,AAPL,"After Hours Most Active for Nov 14, 2023 : NEM, V, EDAP, NU, RBLX, QQQ, INTC, AAPL, GM, CCL, IQ, MTCH"
2023-11-14 00:00:00,AAPL,AAPL Quantitative Stock Analysis
2023-11-14 00:00:00,AAPL,Apple supplier Foxconn posts surprise rise in quarterly profit
2023-11-14 00:00:00,AAPL,The 1 Best Reason to Sell Apple Stock Now May Be a Surprise
2023-11-14 00:00:00,AAPL,"The Zacks Analyst Blog Highlights Apple, Broadcom, Adobe, NextEra Energy and Enbridge"
2023-11-13 00:00:00,AAPL,"Top Stock Reports for Apple, Broadcom & Adobe"
2023-11-13 00:00:00,AAPL,Apple (NASDAQ:AAPL) Stock: An Under-the-Radar AI Play
2023-11-13 00:00:00,AAPL,Apple Stock: The Good and Bad News for AAPL Investors
2023-11-12 00:00:00,AAPL,Guru Fundamental Report for AAPL
2023-11-11 00:00:00,AAPL,Apple Stock: Bull vs. Bear
2023-11-10 00:00:00,AAPL,Apple to file challenge over Digital Markets Act in EU Court- Bloomberg News
2023-11-10 00:00:00,AAPL,Prediction: Microsoft Will Overtake Apple as the World's Largest Company By 2025
2023-11-10 00:00:00,AAPL,"Zacks Market Edge Highlights: AAPL, SONY and IBM"
2023-11-10 00:00:00,AAPL,Validea Detailed Fundamental Analysis - AAPL
2023-11-09 00:00:00,AAPL,Is Apple's Magic Fading?
2023-11-09 00:00:00,AAPL,Guru Fundamental Report for AAPL
2023-11-09 00:00:00,AAPL,"Apple Sales Are in Decline, but 1 Other Stock Is Taking It on the Chin"
2023-11-09 00:00:00,AAPL,"Notable Thursday Option Activity: ZM, ASLE, AAPL"
2023-11-09 00:00:00,AAPL,What Tepid Outlook? Buy Apple ETFs for These 5 Factors
2023-11-09 00:00:00,AAPL,3 Mega-Cap Stocks Analysts Like Better Than Apple
2023-11-09 00:00:00,AAPL,AAPL Stock: Should You Buy the Apple Dip?
2023-11-09 00:00:00,AAPL,Apple Agrees To Pay $25 Mln To Settle Employment Discrimination Allegations
2023-11-09 00:00:00,AAPL,Apple supplier Luxshare to invest $330 mln more in northern Vietnam
2023-11-09 00:00:00,AAPL,Apple agrees to $25 million settlement with US over hiring of immigrants
2023-11-09 00:00:00,AAPL,Setback for Apple as EU court adviser backs EU's $14 bln tax order
2023-11-08 00:00:00,AAPL,AAPL Factor-Based Stock Analysis
2023-11-08 00:00:00,AAPL,Apple's Annual Buybacks Hit a 3-Year Low. Should Investors Be Concerned?
2023-11-08 00:00:00,AAPL,Apple co-founder Wozniak suffers possible stroke in Mexico -local media
2023-11-08 00:00:00,AAPL,"1 Semiconductor Stock Set to Join Apple, Amazon, Microsoft, Alphabet, and NVIDIA in the $1 Trillion Club"
2023-11-08 00:00:00,AAPL,"Reuters NEXT-Apple is not passing on costs of climate goals to consumers, exec says"
2023-11-08 00:00:00,AAPL,AMD and Intel Respond to CPU Competitors Qualcomm and Apple
2023-11-08 00:00:00,AAPL,Why Apple's Services Business Is Such a Big Catalyst for the Stock
2023-11-07 00:00:00,AAPL,Apple CEO Tim Cook's 6 Words That Could Point to a Higher-Growth Future for the Tech Giant
2023-11-07 00:00:00,AAPL,AAPL Quantitative Stock Analysis
2023-11-07 00:00:00,AAPL,"Pre-Market Most Active for Nov 7, 2023 : UBER, BMY, SQQQ, VTYX, AAPL, DDOG, TQQQ, LIFW, PINS, KMI, SNOW, PLTR"
2023-11-07 00:00:00,AAPL,"After Hours Most Active for Nov 7, 2023 : NEM, RIVN, AAPL, VTRS, GRAB, GOOGL, WDC, BVN, PINS, IONQ, PLTR, AVTR"
2023-11-07 00:00:00,AAPL,AAPL Stock Outlook: There Are Still Plenty of Reasons to Take a Bite of Apple
2023-11-07 00:00:00,AAPL,Should Investors Buy Apple Stock on the Dip?
2023-11-06 00:00:00,AAPL,Is Trending Stock Apple Inc. (AAPL) a Buy Now?
2023-11-06 00:00:00,AAPL,"Here's the Artificial Intelligence (AI) Stock Most Likely to Beat Tesla in Joining Apple, Microsoft, Alphabet, Amazon, and Nvidia in the $1 Trillion Club"
2023-11-06 00:00:00,AAPL,"Apple, Amazon, Alphabet, Microsoft and Nvidia are part of Zacks Earnings Preview"
2023-11-06 00:00:00,AAPL,"Pre-Market Most Active for Nov 6, 2023 : SQQQ, AAPL, TSLA, TQQQ, PLTR, HOWL, NIO, TSLL, SONY, F, IONQ, WRK"
2023-11-06 00:00:00,AAPL,3 Reasons I'm Not Too Worried About Apple's So-So Guidance
2023-11-06 00:00:00,AAPL,2 Reasons Apple Stock Is a Buy Today
2023-11-06 00:00:00,AAPL,"After Hours Most Active for Nov 6, 2023 : SHV, BAC, ENV, AAPL, BURL, IXUS, IONQ, ADMA, AMZN, WFC, TVTX, OUT"
2023-11-06 00:00:00,AAPL,"AAPL, LI, or ET: Which Large Cap Stock is the Most Attractive Pick?"
2023-11-05 00:00:00,AAPL,Wall Street Is Hating on Apple Right Now. Here Are 5 Reasons I'm Not.
2023-11-05 00:00:00,AAPL,Guru Fundamental Report for AAPL
2023-11-04 00:00:00,AAPL,AAPL and GOOGL’s Post-Earnings Slump: Time to Buy?
2023-11-03 00:00:00,AAPL,Why Did Apple (AAPL) Drop on an Earnings Beat?
2023-11-03 00:00:00,AAPL,"Apple Q4 Earnings Beat, Outlook Upsets: ETFs in Focus"
2023-11-03 00:00:00,AAPL,"Technology Sector Update for 11/03/2023: AAPL, IAS, FTNT"
2023-11-03 00:00:00,AAPL,"Daily Dividend Report: AAPL,COF,PXD,AME,EOG"
2023-11-03 00:00:00,AAPL,Apple tumbles after warning of dull holiday quarter
2023-11-03 00:00:00,AAPL,US STOCKS-Futures slip on Apple's weak forecast as payrolls data looms
2023-11-03 00:00:00,AAPL,"Technology Sector Update for 11/03/2023: FTNT, AAPL, TEAM, XLK, XSD"
2023-11-03 00:00:00,AAPL,Validea Detailed Fundamental Analysis - AAPL
2023-11-03 00:00:00,AAPL,"After Hours Most Active for Nov 3, 2023 : XOM, QQQ, CD, RSI, RTX, ENB, ING, PAGP, NU, AAPL, CSCO, AMZN"
2023-11-03 00:00:00,AAPL,Apple ticks lower after warning of dull holiday quarter
2023-11-03 00:00:00,AAPL,"Apple (NASDAQ:AAPL) Stock: Don’t Fret Over Holiday Outlook, Says Analyst"
2023-11-03 00:00:00,AAPL,"Apple's (AAPL) Q4 Earnings Beat Estimates, Revenues Fall Y/Y"
2023-11-03 00:00:00,AAPL,"Dow Movers: AAPL, GS"
2023-11-03 00:00:00,AAPL,US STOCKS-Futures slip on Apple's weak forecast; payrolls data looms
2023-11-03 00:00:00,AAPL,"Daily Markets: Investors Digest Apple Earnings, Jobs and Economic Data"
2023-11-03 00:00:00,AAPL,"Pre-Market Most Active for Nov 3, 2023 : HOWL, FUBO, SQQQ, AAPL, TQQQ, NIO, TSLA, CLLS, PLTR, SQ, CVNA, F"
2023-11-02 00:00:00,AAPL,Guru Fundamental Report for AAPL
2023-11-02 00:00:00,AAPL,Apple (AAPL) Q4 2023 Earnings: What to Expect
2023-11-02 00:00:00,AAPL,"Apple Inc. Q4 Income Advances, Beats estimates"
2023-11-02 00:00:00,AAPL,Apple Q4 23 Earnings Conference Call At 5:00 PM ET
2023-11-02 00:00:00,AAPL,"MORNING BID AMERICAS-Markets fly on Fed and funding, Apple awaits"
2023-11-02 00:00:00,AAPL,Apple's Loaded Product Lineup Headed Into the Holidays Is Good News for Investors
2023-11-02 00:00:00,AAPL,"Apple Inc. Announces Increase In Q3 Income, Beats estimates"
2023-11-02 00:00:00,AAPL,"After-Hours Earnings Report for November 2, 2023 : AAPL, SYK, BKNG, EOG, PXD, MNST, MSI, FTNT, MCHP, ED, TEAM, SBAC"
2023-11-02 00:00:00,AAPL,Beyond the Apple Hype: An AAPL Stock Reality Check
2023-11-02 00:00:00,AAPL,Markets Up Big Again; Apple (AAPL) Beats Modestly
2023-11-02 00:00:00,AAPL,"Noteworthy Thursday Option Activity: MRNA, AAPL, COIN"
2023-11-02 00:00:00,AAPL,Apple Earnings Highlight Double-Digit Earnings Growth
2023-11-02 00:00:00,AAPL,"China iPhone sales strong, Apple tells investors as Huawei threat looms"
2023-11-02 00:00:00,AAPL,Apple beats quarterly estimates as iPhone sales edge up
2023-11-02 00:00:00,AAPL,"After Hours Most Active for Nov 2, 2023 : PENN, SQ, RSI, AAPL, GOOG, PFE, CSX, DKNG, QQQ, NU, RTX, BAC"
2023-11-02 00:00:00,AAPL,"China iPhone sales strong, Apple tells investors as Huawei threat looms"
2023-11-01 00:00:00,AAPL,Apple's (AAPL) Q4 Earnings to Suffer from Weak Mac & iPad Sales
2023-11-01 00:00:00,AAPL,AAPL Factor-Based Stock Analysis
2023-11-01 00:00:00,AAPL,"After a 540% Rise, Why Does Warren Buffett Still Own Apple Stock?"
2023-11-01 00:00:00,AAPL,"PREVIEW-Apple's holiday-quarter forecast faces threat from Huawei, weak China market"
2023-11-01 00:00:00,AAPL,Better Buy: Apple vs. Coca-Cola
2023-11-01 00:00:00,AAPL,Is Apple Stock a Buy?
2023-11-01 00:00:00,AAPL,Will Apple’s (NASDAQ:AAPL) Hardware Sales Disappoint in Q4?
2023-11-01 00:00:00,AAPL,"After Hours Most Active for Nov 1, 2023 : PPL, HST, RTX, ENB, DEN, AMZN, VONG, TFC, AAPL, AES, ACWI, TQQQ"
2023-11-01 00:00:00,AAPL,Unveiling Apple (AAPL) Q4 Outlook: Wall Street Estimates for Key Metrics
2023-11-01 00:00:00,AAPL,"Mass lawsuit against Apple over iPhone batteries can go ahead, London tribunal rules"
2023-11-01 00:00:00,AAPL,Should You Buy These 2 ‘Magnificent Seven’ Stocks Ahead of Earnings? Apple and Nvidia in Focus
2023-11-01 00:00:00,AAPL,"Disney's ESPN could be valued at $24 bln, likely buyers include Apple, Verizon - BofA"
2023-11-01 00:00:00,AAPL,Apple Earnings: Why Guidance Will Be Key
2023-10-31 00:00:00,AAPL,"The Zacks Analyst Blog Highlights Apple, McKesson, Emerson Electric and Bae Systems"
2023-10-31 00:00:00,AAPL,"After Hours Most Active for Oct 31, 2023 : KVUE, RIVN, PR, ET, AMD, WBD, NEE, AAPL, RTX, O, VCIT, WBA"
2023-10-31 00:00:00,AAPL,Time to Buy Apple (AAPL) or Qualcomm's (QCOM) Stock as Earnings Approach?
2023-10-31 00:00:00,AAPL,Can Q4 Earnings Give a New Lease of Life to Apple ETFs?
2023-10-31 00:00:00,AAPL,AAPL Quantitative Stock Analysis - Peter Lynch
2023-10-31 00:00:00,AAPL,Is Microsoft About to Overtake Apple as the World's Most Valuable Company?
2023-10-31 00:00:00,AAPL,"New Chips May Not Lift AAPL Stock, But Apple’s Services Biz Is Booming"
2023-10-31 00:00:00,AAPL,Needham Reiterates Apple (AAPL) Buy Recommendation
2023-10-31 00:00:00,AAPL,Apple (AAPL) to Report Q4 Earnings: What's in the Offing?
2023-10-30 00:00:00,AAPL,Keybanc Reiterates Apple (AAPL) Sector Weight Recommendation
2023-10-30 00:00:00,AAPL,Is Apple a buy ahead of earnings?
2023-10-30 00:00:00,AAPL,"Up 34% This Year, Will Apple Stock Rally Further Following Q4 Results?"
2023-10-30 00:00:00,AAPL,Oppenheimer Maintains Apple (AAPL) Outperform Recommendation
2023-10-30 00:00:00,AAPL,Apple expected to unveil new Macs as PC industry slump eases
2023-10-30 00:00:00,AAPL,"Apple Unveils Three M3 Chips, New MacBook Pros And IMacs"
2023-10-30 00:00:00,AAPL,Apple Q4 Preview: Should Investors Take a Bite?
2023-10-30 00:00:00,AAPL,Barclays Maintains Apple (AAPL) Equal-Weight Recommendation
2023-10-30 00:00:00,AAPL,"Apple, Intel, AMD, Qualcomm, and NVIDIA: Is the CPU Market Overcrowded or Just Heating Up?"
2023-10-30 00:00:00,AAPL,"After Hours Most Active for Oct 30, 2023 : RTX, AMBP, PINS, AYX, QQQ, AAPL, ING, GOOGL, GMED, AMZN, MSFT, AMD"
2023-10-30 00:00:00,AAPL,"Amazon, Microsoft, Alphabet, Apple and Nvidia are part of Zacks Earnings Preview"
2023-10-30 00:00:00,AAPL,Apple introduces new MacBook Pro and M3 chip family
2023-10-29 00:00:00,AAPL,"Weekly Preview: Earnings to Watch This Week 10-29-23 (AMD, AAPL, MRNA, SQ)"
2023-10-29 00:00:00,AAPL,Guru Fundamental Report for AAPL
2023-10-29 00:00:00,AAPL,"If You Had Invested $10,000 in Apple When the iPhone Came Out, This Is How Much You Would Have Today"
2023-10-28 00:00:00,AAPL,Can Apple Stock Double in 5 Years? Here's What It Would Take.
2023-10-27 00:00:00,AAPL,Validea Detailed Fundamental Analysis - AAPL
2023-10-27 00:00:00,AAPL,"Technology Sector Update for 10/27/2023: MASI, AAPL, INTC, SWI, AGRI"
2023-10-26 00:00:00,AAPL,1 Simple Reason Warren Buffett Prefers to Buy Apple Rather Than Tesla Stock
2023-10-26 00:00:00,AAPL,"The New CPU King? Outperforming Intel, Advanced Micro Devices, and Apple CPUs?"
2023-10-26 00:00:00,AAPL,Apple Reports After the Close on 11/2 -- Options Contracts Expire the Next Day
2023-10-26 00:00:00,AAPL,Oversold Conditions For Apple
2023-10-26 00:00:00,AAPL,US trade tribunal issues potential Apple Watch import ban in Masimo patent fight
2023-10-26 00:00:00,AAPL,"Noteworthy Thursday Option Activity: MRNA, AAPL, ENPH"
2023-10-26 00:00:00,AAPL,Apple Makes Up Almost 50% of Warren Buffett's Portfolio: Is the Stock a Buy?
2023-10-26 00:00:00,AAPL,US trade tribunal issues potential Apple Watch import ban in Masimo patent fight
2023-10-26 00:00:00,AAPL,Guru Fundamental Report for AAPL
2023-10-25 00:00:00,AAPL,Apple (NASDAQ:AAPL): This “Magnificent Seven” Stock is Too Unloved
2023-10-25 00:00:00,AAPL,"After Hours Most Active for Oct 25, 2023 : QQQ, META, AAPL, RTX, SIRI, KVUE, TQQQ, RSI, XOM, SNAP, SQQQ, WFC"
2023-10-25 00:00:00,AAPL,Huawei's China smartphone sales surge in Q3 as Apple declines - research firms
2023-10-25 00:00:00,AAPL,AAPL Factor-Based Stock Analysis
2023-10-25 00:00:00,AAPL,"Apple raises subscription prices for TV+, News+"
2023-10-25 00:00:00,AAPL,"Apple hikes price of Apple TV+, Apple News+"
2023-10-25 00:00:00,AAPL,"The Zacks Analyst Blog Highlights Meta, Apple, Pinterest and Model N"
2023-10-24 00:00:00,AAPL,"EXCLUSIVE-Apple to make tools and parts to fix phones, computers available nationwide - White House"
2023-10-24 00:00:00,AAPL,"The Zacks Analyst Blog Highlights Meta Platforms, Apple, Amazon, Alphabet and Microsoft"
2023-10-24 00:00:00,AAPL,AAPL Quantitative Stock Analysis
2023-10-24 00:00:00,AAPL,Corning's shares fall as the Apple supplier forecasts Q4 core sales below estimates
2023-10-24 00:00:00,AAPL,"EXCLUSIVE-Apple to make tools and parts to fix phones, computers available nationwide - White House"
2023-10-24 00:00:00,AAPL,"Apple, exec Eddy Cue fight subpoena in NFL 'Sunday Ticket' case"
