Date,Stock_symbol,Article_title
2022-08-19 00:00:00,AAPL,"Apple Warns Of Security Flaws In IPhones, IPads, Macs"
2022-08-19 00:00:00,AAPL,"After Hours Most Active for Aug 19, 2022 : GERN, BAC, VCSH, KGC, VTWO, FTI, NYMT, AAPL, AVDX, MPW, COTY, VICI"
2022-08-19 00:00:00,AAPL,"Zacks Value Investor Highlights: Chevron, Occidental Petroleum, Apple, Activision Blizzard and Amazon"
2022-08-18 00:00:00,AAPL,"Notable ETF Inflow Detected - QQQ, AAPL, MSFT, META"
2022-08-18 00:00:00,AAPL,Why I'm Bullish on Apple Stock
2022-08-18 00:00:00,AAPL,Apple Likely To Launch IPhone 14 On Sept. 7
2022-08-17 00:00:00,AAPL,Apple Stock Has Upside Potential and New Gadgets on the Way
2022-08-17 00:00:00,AAPL,Apple suppliers to make Apple Watch and MacBook in Vietnam - Nikkei
2022-08-16 00:00:00,AAPL,1 Metric That Apple Investors Should Stop Worrying About
2022-08-16 00:00:00,AAPL,Apple Sets Sept. 5 Deadline For Return To Office
2022-08-16 00:00:00,AAPL,Apple suppliers to make Apple Watch and MacBook in Vietnam - Nikkei
2022-08-16 00:00:00,AAPL,"Pre-Market Most Active for Aug 16, 2022 : AMTD, DNA, BBBY, WMT, SQQQ, TQQQ, NU, BBWI, CVX, AMZN, AAPL, TLRY"
2022-08-15 00:00:00,AAPL,"After Hours Most Active for Aug 15, 2022 : WBD, DNA, OPEN, TSM, PINS, ACWI, BABA, NLSN, T, AAPL, INTC, CSCO"
2022-08-15 00:00:00,AAPL,"Buffett Buys More Apple, Chevron, Occidental Petroleum, in Q2"
2022-08-15 00:00:00,AAPL,Dow Analyst Moves: AAPL
2022-08-15 00:00:00,AAPL,Apple's $30 mln settlement over employee bag checks gets court approval
2022-08-15 00:00:00,AAPL,Is Most-Watched Stock Apple Inc. (AAPL) Worth Betting on Now?
2022-08-11 00:00:00,AAPL,"After Hours Most Active for Aug 11, 2022 : SWN, SCHW, RIVN, INTC, CWK, SU, AAPL, BAC, GOOGL, FE, MSFT, CCXI"
2022-08-11 00:00:00,AAPL,3 Reasons to Buy Apple Stock Now
2022-08-10 00:00:00,AAPL,1 Emerging Catalyst That Apple Investors May Have Missed
2022-08-10 00:00:00,AAPL,"SPLG, AAPL, MSFT, BRK.B: Large Inflows Detected at ETF"
2022-08-10 00:00:00,AAPL,"Here's What Apple, Walmart, and UPS Just Told Us About the Broader Economy"
2022-08-10 00:00:00,AAPL,3 Reasons to Buy Apple Stock Now
2022-08-10 00:00:00,AAPL,Apple supplier Foxconn's Q2 profit up 12% on cloud demand
2022-08-10 00:00:00,AAPL,Apple supplier Foxconn's Q2 profit up nearly 12%
2022-08-09 00:00:00,AAPL,"Pre-Market Most Active for Aug 9, 2022 : NLSN, VRNA, BBBY, SQQQ, TQQQ, AMC, AAPL, GDRX, CCL, PLTR, AMTD, NCLH"
2022-08-07 00:00:00,AAPL,This Latest Move by Apple Should Have The Trade Desk Shaking in Its Boots
2022-08-07 00:00:00,AAPL,Should You Really Follow Warren Buffett's Lead on Apple Stock?
2022-08-06 00:00:00,AAPL,Taiwan-based Apple supplier challenged by investor over $4 billion cash pile- FT
2022-08-06 00:00:00,AAPL,Apple: Is Advertising the Next Big Revenue Generator? Analyst Weighs In
2022-08-06 00:00:00,AAPL,Why Apple Stock Jumped 18.9% in July
2022-08-05 00:00:00,AAPL,Apple Stock: Advertisement Expansion Seems Heavily Discounted
2022-08-05 00:00:00,AAPL,Apple asks suppliers to follow China customs rules - Nikkei
2022-08-04 00:00:00,AAPL,Apple Has Been Dethroned as the Most Held Robinhood Stock: Here's What Replaced It
2022-08-04 00:00:00,AAPL,"S&P 500 flat as Apple, energy shares weigh"
2022-08-04 00:00:00,AAPL,"Zacks Investment Ideas feature highlights: Apple, Exxon Mobil, and Microsoft"
2022-08-04 00:00:00,AAPL,"Wall Street slips on losses in Apple, energy shares"
2022-08-04 00:00:00,AAPL,"Notable Thursday Option Activity: TSLA, AAPL, K"
2022-08-04 00:00:00,AAPL,Better Buy: Apple or Every Nasdaq Stock?
2022-08-04 00:00:00,AAPL,Buy and Hold Apple Stock for the Long Term
2022-08-03 00:00:00,AAPL,"After Hours Most Active for Aug 3, 2022 : LCID, T, CMCSA, LYFT, IQ, AAPL, IS, GOOGL, EAF, NYCB, BSIG, CHS"
2022-08-03 00:00:00,AAPL,"Q2 Earnings Scorecard and Research Reports for Apple, Chevron & Toyota"
2022-08-03 00:00:00,AAPL,1 Surprising Catalyst for Apple Stock
2022-08-02 00:00:00,AAPL,Supply Chain Constraints Ease as Apple Reports $83 Billion in Revenue
2022-08-02 00:00:00,AAPL,Apple Inc. (AAPL) is Attracting Investor Attention: Here is What You Should Know
2022-08-02 00:00:00,AAPL,"Pre-Market Most Active for Aug 2, 2022 : AMTD, KRKR, FFIE, NLY, UBER, SQQQ, REV, TQQQ, KMI, AAPL, AMD, PINS"
2022-08-02 00:00:00,AAPL,3 Bullish Comments From Apple Management
2022-08-01 00:00:00,AAPL,Apple drops mask requirements for most of its corporate workers - The Verge
2022-08-01 00:00:00,AAPL,Should Investors Worry About Apple's Slowing Services Business?
2022-08-01 00:00:00,AAPL,How Smart Investors Should React to Apple Earnings
2022-08-01 00:00:00,AAPL,Here's Why Alphabet Has Done Relatively Well Amid Apple's Privacy Changes
2022-07-29 00:00:00,AAPL,"Apple, Amazon & Big Tech Showcase Their Earnings Power Once Again"
2022-07-29 00:00:00,AAPL,"After Hours Most Active for Jul 29, 2022 : CORZ, AAPL, AMZN, WBD, OPEN, CAN, BAC, TAL, NEM, T, WFC, SCHW"
2022-07-29 00:00:00,AAPL,Why Apple Stock Climbed Today
2022-07-29 00:00:00,AAPL,AAPL Crosses Above Key Moving Average Level
2022-07-29 00:00:00,AAPL,"Daily Dividend Report: STE,VST,AAPL,MCD,UNP"
2022-07-29 00:00:00,AAPL,"Nasdaq, S&P 500 rise on upbeat forecasts from Apple, Amazon"
2022-07-29 00:00:00,AAPL,Drilling Down into Apple's 3Q Print
2022-07-29 00:00:00,AAPL,"Apple Posts Record Revenues, Beats on Earnings: ETFs to Buy"
2022-07-29 00:00:00,AAPL,"Technology Sector Update for 07/29/2022: XLK, INTC, AAPL, NAAS"
2022-07-29 00:00:00,AAPL,"Nasdaq, S&P 500 rise on upbeat forecasts from Apple, Amazon"
2022-07-29 00:00:00,AAPL,"Amazon, Apple raise hopes as investors brace for slowdown"
2022-07-29 00:00:00,AAPL,Apple faces lukewarm demand in China after quarterly revenue drop -analysts
2022-07-29 00:00:00,AAPL,"US STOCKS-Nasdaq set to open higher on positive forecasts from Apple, Amazon"
2022-07-29 00:00:00,AAPL,"Technology Sector Update for 07/29/2022: INTC, AAPL, SONY, XLK, SOXX"
2022-07-29 00:00:00,AAPL,Apple Aces Earnings and Amazon's Outlook Cheers Investors as Stocks Rise
2022-07-29 00:00:00,AAPL,"Apple (AAPL) Q3 Earnings Top Estimates, Revenues Increase Y/Y"
2022-07-29 00:00:00,AAPL,"Apple Loses Steam, but iPhone Demand Remains Strong -- Is the Stock a Buy?"
2022-07-29 00:00:00,AAPL,"Nasdaq, S&P 500 open higher on positive forecasts from Apple, Amazon"
2022-07-29 00:00:00,AAPL,"US STOCKS-Nasdaq futures surge as Apple, Amazon hold out against weak consumer spending"
2022-07-28 00:00:00,AAPL,Apple Q3 Results Beat Wall Street View; Shares Up 3%
2022-07-28 00:00:00,AAPL,"Apple Inc. Announces Decline In Q3 Income, but beats estimates"
2022-07-28 00:00:00,AAPL,"Amazon, Apple Up on Earnings; Intel Takes a Bath"
2022-07-28 00:00:00,AAPL,Apple (AAPL) Tops Q3 Earnings and Revenue Estimates
2022-07-28 00:00:00,AAPL,"Wall St ends up sharply for 2nd day; Amazon.com, Apple jump after hours"
2022-07-28 00:00:00,AAPL,"After-Hours Earnings Report for July 28, 2022 : AAPL, AMZN, INTC, EW, KLAC, LHX, DLR, AJG, DXCM, SGEN, CLR, EIX"
2022-07-28 00:00:00,AAPL,Apple’s aging clout
2022-07-28 00:00:00,AAPL,Apple results top estimates as iPhone escapes economic slump
2022-07-28 00:00:00,AAPL,"The Countdown to Apple Earnings Is On, Here’s What to Expect"
2022-07-28 00:00:00,AAPL,TD Ameritrade: Todd Rosenbluth Talks Apple and Amazon ETFs Ahead of Earnings
2022-07-28 00:00:00,AAPL,Apple (AAPL) Q3 Earnings: What to Expect
2022-07-28 00:00:00,AAPL,Warren Buffett Bought More Apple Stock. Should Investors Follow Suit?
2022-07-28 00:00:00,AAPL,Apple Q3 22 Earnings Conference Call At 5:00 PM ET
2022-07-28 00:00:00,AAPL,"Zacks Investment Ideas feature highlights: Quanex, Taiwan Semiconductor, Kronos, Apple, Nvidia and Advanced Micro Devices"
2022-07-28 00:00:00,AAPL,Why Apple Stock May Outperform in a Recession
2022-07-28 00:00:00,AAPL,Why Warren Buffett Loves Apple
2022-07-27 00:00:00,AAPL,Can Continued Services Growth Aid Apple's (AAPL) Q3 Earnings?
2022-07-27 00:00:00,AAPL,Is a Surprise Coming for Apple (AAPL) This Earnings Season?
2022-07-27 00:00:00,AAPL,"Apple Could Outperform Peers In Q3, Says Top Analyst"
2022-07-27 00:00:00,AAPL,"If You'd Invested $3,000 in Apple in 2007, This Is How Much You Would Have Today"
2022-07-26 00:00:00,AAPL,Prepare for Apple Stock to Hit $200 or More
2022-07-25 00:00:00,AAPL,Apple Q3 Preview: Can The Earnings Streak Continue?
2022-07-25 00:00:00,AAPL,Apple (AAPL) to Report Q3 Earnings: What's in the Offing?
2022-07-25 00:00:00,AAPL,"Technology Sector Update for 07/25/2022: META,AAPL,SSYS,NNDM,GILT"
2022-07-25 00:00:00,AAPL,"Notable ETF Inflow Detected - VOO, AAPL, MSFT, BRK.B"
2022-07-25 00:00:00,AAPL,"Meta, Amazon, Google, Apple Report this Week, and Stocks Face Test of Recent Strength as Rate Hike, GDP Data on Tap"
2022-07-25 00:00:00,AAPL,"Alphabet, Microsoft, Meta, Apple and Amazon are part of Zacks Earnings Preview"
2022-07-25 00:00:00,AAPL,"Zacks Investment Ideas feature highlights: Apple, Adobe and Advanced Micro Devices"
2022-07-24 00:00:00,AAPL,"Weekly Preview: Earnings To Watch Week of July 24 (AAPL, AMZN, GOOG, META, MSFT)"
2022-07-22 00:00:00,AAPL,"After Hours Most Active for Jul 22, 2022 : CCL, CMCSA, QQQ, SNAP, BEKE, AMTD, NLSN, HR, AAPL, AMD, AMZN, MSFT"
2022-07-22 00:00:00,AAPL,AAPL February 2023 Options Begin Trading
2022-07-22 00:00:00,AAPL,Apple Inc. (AAPL) Is a Trending Stock: Facts to Know Before Betting on It
2022-07-21 00:00:00,AAPL,"Apple: Don’t Underestimate the Continued Growth Story, Says Analyst"
2022-07-21 00:00:00,AAPL,See Which Of The Latest 13F Filers Holds Apple
2022-07-21 00:00:00,AAPL,"Zacks Market Edge Highlights: Microsoft, Apple, Sony, Expedia and Booking"
2022-07-21 00:00:00,AAPL,"PREVIEW-Social media revenue growth expected to slow as TikTok, Apple compete"
2022-07-20 00:00:00,AAPL,"Notable Wednesday Option Activity: TSLA, NVDA, AAPL"
2022-07-20 00:00:00,AAPL,Apple (AAPL) Outpaces Stock Market Gains: What You Should Know
2022-07-20 00:00:00,AAPL,Apple outlines health technology strategy in new report
2022-07-20 00:00:00,AAPL,Looking for a Dividend Growth Stock? Look No Further Than Apple
2022-07-19 00:00:00,AAPL,"Why Apple, Amazon, and Intel Jumped Higher Today"
2022-07-19 00:00:00,AAPL,"Apple To Slow Down Hiring, Spend Less In 2023"
2022-07-19 00:00:00,AAPL,"After Hours Most Active for Jul 19, 2022 : PDBC, BEKE, NFLX, GRBK, QQQ, CSX, AAPL, VG, SYF, DM, TAL, IBM"
2022-07-19 00:00:00,AAPL,Is This Bad News for Apple Stock?
2022-07-19 00:00:00,AAPL,"The Zacks Analyst Blog Highlights Apple, UnitedHealth Group, Equinor, GSK and Eaton"
2022-07-19 00:00:00,AAPL,"Pre-Market Most Active for Jul 19, 2022 : STIM, TQQQ, SQQQ, QQQ, AAPL, GOEV, NIO, IBM, NVTA, AMC, WFG, CCL"
2022-07-19 00:00:00,AAPL,US STOCKS-Futures rise as Apple ekes out gains as earnings gather steam
2022-07-19 00:00:00,AAPL,Russia says it will fine Apple for violating antitrust laws
2022-07-19 00:00:00,AAPL,Russia says Apple violates antitrust laws
2022-07-18 00:00:00,AAPL,Apple (AAPL) Spending Cuts Drain Rally; IBM Beats Again
2022-07-18 00:00:00,AAPL,"US STOCKS-Wall Street closes down on slide in Apple shares, bank stocks"
2022-07-18 00:00:00,AAPL,Lawsuit accuses Apple of antitrust violations over Apple Pay
2022-07-18 00:00:00,AAPL,US STOCKS-Wall Street reverses course on slide in Apple shares
2022-07-18 00:00:00,AAPL,"Wall Street ends lower on slide in Apple shares, bank stocks"
2022-07-18 00:00:00,AAPL,"Apple to slow hiring, spending for some teams next year - Bloomberg"
2022-07-18 00:00:00,AAPL,Can Apple (AAPL) Keep the Earnings Surprise Streak Alive?
2022-07-15 00:00:00,AAPL,"Noteworthy ETF Inflows: QQQ, AAPL, MSFT, PEP"
2022-07-15 00:00:00,AAPL,"Taiwan accuses Chinese Apple supplier of stealing secrets, charges 14"
2022-07-15 00:00:00,AAPL,Better Tech Stock: Apple vs. Microsoft
2022-07-14 00:00:00,AAPL,Apple Stock: Intriguing Value Amid Market Storm
2022-07-14 00:00:00,AAPL,Apple Stock This Earnings Season: Buy or Sell?
2022-07-13 00:00:00,AAPL,"Apple's (AAPL) TV+, Led by Ted Lasso, Gets 52 Emmy Nominations"
2022-07-13 00:00:00,AAPL,"After Hours Most Active for Jul 13, 2022 : IQ, CVX, IBN, NIO, CMCSA, AAPL, CBAY, ZIM, HPE, PPL, TLT, DCPH"
2022-07-13 00:00:00,AAPL,"Why Apple, Okta, and Nvidia Stocks Tumbled Today"
2022-07-13 00:00:00,AAPL,"PREVIEW-Apple hovers above competition even as smartphone market stumbles, sources say"
2022-07-13 00:00:00,AAPL,"Macro Headwinds to Hurt Apple’s Growth, Says Analyst"
2022-07-13 00:00:00,AAPL,Stay Focused on the $180 Price Target for Apple Stock
2022-07-13 00:00:00,AAPL,"Zacks Investment Ideas feature highlights: Apple, Occidental Petroleum and HP"
2022-07-12 00:00:00,AAPL,Don’t Let Near-Term Issues Cloud Your View on Apple Stock
2022-07-12 00:00:00,AAPL,Why Apple Stock Is Down 17% So Far This Year
2022-07-12 00:00:00,AAPL,"After Hours Most Active for Jul 12, 2022 : ADTN, F, CSCO, AAPL, UBER, QQQ, T, VZ, PBF, TQQQ, CNP, APA"
2022-07-12 00:00:00,AAPL,Apple has ended consulting deal with former designer Jony Ive -NY Times
2022-07-12 00:00:00,AAPL,Russia fines Apple and Zoom for alleged data storage violation
2022-07-12 00:00:00,AAPL,Russia fines Apple over alleged data storage violation - Ifax
2022-07-12 00:00:00,AAPL,Apple Earnings: Will Supply Shortages Hurt Sales?
2022-07-11 00:00:00,AAPL,Investors Heavily Search Apple Inc. (AAPL): Here is What You Need to Know
2022-07-08 00:00:00,AAPL,"Apple Should Beat June Quarter Expectations but Guide for September Could Disappoint, Says Analyst"
2022-07-07 00:00:00,AAPL,"After Hours Most Active for Jul 7, 2022 : SWN, BMY, AUY, QQQ, OPEN, TWTR, LYFT, CI, PINS, AAPL, CSCO, XP"
2022-07-07 00:00:00,AAPL,"Pre-Market Most Active for Jul 7, 2022 : TQQQ, SQQQ, FFIE, NIO, QQQ, F, ANVS, CCL, AAPL, BP, BBBY, TEN"
2022-07-07 00:00:00,AAPL,Interesting AAPL Put And Call Options For August 26th
2022-07-06 00:00:00,AAPL,"After Hours Most Active for Jul 6, 2022 : SWN, BEKE, FRSH, OPEN, TFC, DNB, VG, MSFT, AAPL, MDT, AMZN, CYH"
2022-07-06 00:00:00,AAPL,Apple to release new 'Lockdown Mode' as it battles spyware firms
2022-07-06 00:00:00,AAPL,Apple Stock Remains a Buy As the iPhone Turns 15
2022-07-06 00:00:00,AAPL,Apple will Continue to Prove its Naysayers Wrong
2022-07-05 00:00:00,AAPL,5-Star Analyst Lays Out the Bullish Case for Apple Stock
2022-07-05 00:00:00,AAPL,Apple (AAPL) Outpaces Stock Market Gains: What You Should Know
2022-07-05 00:00:00,AAPL,Alphabet vs. Apple: Which FAANG Stock Does Wall Street Like the Most?
2022-07-05 00:00:00,AAPL,"Pre-Market Most Active for Jul 5, 2022 : TQQQ, SQQQ, OCFT, QQQ, FCX, CCL, REV, NIO, COP, CLVS, AAPL, AMD"
2022-07-04 00:00:00,AAPL,Will Apple TV+ Ever Become Profitable?
2022-07-03 00:00:00,AAPL,The Next Apple Product Launch Paves the Way for Major Gains
2022-07-02 00:00:00,AAPL,Will the Apple and MLS Deal Attract a New Generation?
2022-07-01 00:00:00,AAPL,"Apple: The iPhone Upgrade Cycle Is Underappreciated, Says 5-Star Analyst"
2022-07-01 00:00:00,AAPL,"This Famous 'Big Short' Investor Is Betting Big Against Apple, but Buying This Stock"
2022-07-01 00:00:00,AAPL,Better Augmented Reality Stock: Apple vs. Nvidia
2022-07-01 00:00:00,AAPL,"Pre-Market Most Active for Jul 1, 2022 : TQQQ, SQQQ, KSS, NIO, QQQ, MU, AAPL, SNY, CCL, XPEV, DAL, BP"
2022-07-01 00:00:00,AAPL,Apple hikes Japan price of iPhone by nearly a fifth
2022-06-30 00:00:00,AAPL,Apple Allows App Developers To Use 3rd-party Payment Systems In South Korea
2022-06-30 00:00:00,AAPL,"After Hours Most Active for Jun 30, 2022 : MU, TAL, AAPL, IUSV, MRK, QQQ, EQT, AMZN, GSK, MSFT, WFC, ZYME"
2022-06-30 00:00:00,AAPL,"Why Amazon, Apple, and Nvidia Are Falling Today"
2022-06-30 00:00:00,AAPL,"Enjoy Technology, led by ex-Apple and JC Penney executive Johnson, files bankruptcy"
2022-06-30 00:00:00,AAPL,3 Reasons Why Apple Stock Is a Buy
2022-06-30 00:00:00,AAPL,"Technology Sector Update for 06/30/2022: BRAG, TGAN, AAPL, XLK, SOXX"
2022-06-30 00:00:00,AAPL,"Pre-Market Most Active for Jun 30, 2022 : TQQQ, ASPN, SQQQ, DNAY, QQQ, NIO, CCL, ACI, LI, XPEV, AAPL, COP"
2022-06-30 00:00:00,AAPL,FOCUS-Apple eyes fuel purchases from dashboard as it revs up car software
2022-06-30 00:00:00,AAPL,"Down 20% in 6 Months, Is Now the Time to Buy Apple Stock?"
2022-06-29 00:00:00,AAPL,FCC Commissioner Asks Apple And Google To Remove TikTok From App Stores
2022-06-29 00:00:00,AAPL,Why Apple Stock Climbed on Wednesday
2022-06-29 00:00:00,AAPL,"A U.S. FCC commissioner urges Apple, Google to boot TikTok from app stores"
2022-06-29 00:00:00,AAPL,"Noteworthy ETF Inflows: QQQ, AAPL, MSFT, PEP"
2022-06-29 00:00:00,AAPL,Apple Stock Remains Solid Despite Mounting Inflation Concerns
2022-06-29 00:00:00,AAPL,Here is What to Know Beyond Why Apple Inc. (AAPL) is a Trending Stock
2022-06-29 00:00:00,AAPL,"Is Apple’s Push Into the Buy Now, Pay Later Space a Mistake?"
2022-06-29 00:00:00,AAPL,What's The Outlook Like For Apple Suppliers?
2022-06-28 00:00:00,AAPL,Why Apple Was a Sour Stock on Tuesday
2022-06-28 00:00:00,AAPL,US Supreme Court Rejects Apple Attempts To Restart Qualcomm Patent Dispute
2022-06-28 00:00:00,AAPL,Apple (AAPL) Boosts Content Portfolio With Animal Pictures Deal
2022-06-28 00:00:00,AAPL,Apple (AAPL) Likely to Launch New Macs With Four M2 Chip Variants
2022-06-28 00:00:00,AAPL,Wall Street Continues to be Optimistic on Apple Stock: Here’s Why
2022-06-27 00:00:00,AAPL,"Notable Monday Option Activity: TSLA, AAPL, CRM"
2022-06-27 00:00:00,AAPL,"After Hours Most Active for Jun 27, 2022 : SWN, PINS, ZI, TAL, INTC, AAPL, KZR, QQQ, BZ, MDT, INFY, TFC"
2022-06-27 00:00:00,AAPL,Apple (AAPL) Flat As Market Sinks: What You Should Know
2022-06-27 00:00:00,AAPL,U.S. Supreme Court won't hear Apple's bid to revive Qualcomm patent challenges
2022-06-26 00:00:00,AAPL,Missed Out on Apple Stock? 2 Growth Stocks to Buy and Hold Forever.
2022-06-24 00:00:00,AAPL,Why Apple and Alphabet Stocks Popped on Friday
2022-06-24 00:00:00,AAPL,Apple will not challenge Maryland store unionization vote
2022-06-24 00:00:00,AAPL,"Pre-Market Most Active for Jun 24, 2022 : TQQQ, SQQQ, ZEN, NIO, REV, QQQ, BABA, LI, ET, PSNY, AAPL, CCL"
2022-06-24 00:00:00,AAPL,Should You Buy Apple Stock Right Now?
2022-06-23 00:00:00,AAPL,Apple's 'Buy Now Pay Later' Could Be Major Fintech Disruptor
2022-06-23 00:00:00,AAPL,What A Recession Would Mean For Apple Stock
2022-06-23 00:00:00,AAPL,"After Hours Most Active for Jun 23, 2022 : KGC, CMCSA, SWN, JD, AAPL, TSM, ERIC, SYF, SNAP, MSFT, CSX, GM"
2022-06-23 00:00:00,AAPL,Apple Workers In Maryland Form Union
2022-06-23 00:00:00,AAPL,Apple Stock-Is Now the Right Time To Add Shares?
2022-06-23 00:00:00,AAPL,Should You Buy Apple Stock? Two Key Issues to Consider
2022-06-23 00:00:00,AAPL,"Apple and Android phones hacked by Italian spyware, Google says"
2022-06-23 00:00:00,AAPL,AAPL August 5th Options Begin Trading
2022-06-22 00:00:00,AAPL,"After Hours Most Active for Jun 22, 2022 : NIO, QQQ, ITUB, BAC, AAPL, CLVT, TLT, AMZN, MSFT, FHN, X, AMD"
2022-06-22 00:00:00,AAPL,"If You'd Invested $10,000 in Apple in 2012, This Is How Much You Would Have Today"
2022-06-22 00:00:00,AAPL,Apple Stock: WWDC Innovations Suggest Big Video-Game Push Coming
2022-06-21 00:00:00,AAPL,"XLK, MSFT, AAPL, AVGO: Large Inflows Detected at ETF"
2022-06-21 00:00:00,AAPL,"After Hours Most Active for Jun 21, 2022 : ITUB, VZ, AUY, BAC, AMZN, KGC, MSFT, QQQ, KDP, AAPL, MDLZ, VALE"
2022-06-21 00:00:00,AAPL,Why Apple Stock Surged on Tuesday
2022-06-21 00:00:00,AAPL,"Pre-Market Most Active for Jun 21, 2022 : TQQQ, BKSY, REV, SQQQ, NIO, AAPL, QQQ, AMZN, ACAD, CCL, HAL, BABA"
2022-06-21 00:00:00,AAPL,"The Zacks Analyst Blog Highlights Apple, NVIDIA, McDonald's, Cisco Systems and Vertex Pharmaceuticals"
2022-06-20 00:00:00,AAPL,Apple’s Innovations Position the Stock for Long-Term Growth
2022-06-17 00:00:00,AAPL,"After Hours Most Active for Jun 17, 2022 : KDP, ON, UA, UAA, AAPL, CSCO, T, DBRG, WFC, AMZN, VICI, URBN"
2022-06-17 00:00:00,AAPL,Apple Is Betting Big on Sports
2022-06-17 00:00:00,AAPL,Apple Stock: Bull vs. Bear
2022-06-17 00:00:00,AAPL,"Buy, Sell, or Hold SoFi Stock After Apple’s Announcement?"
2022-06-17 00:00:00,AAPL,Is Trending Stock Apple Inc. (AAPL) a Buy Now?
2022-06-17 00:00:00,AAPL,"Pre-Market Most Active for Jun 17, 2022 : REV, TQQQ, BABA, SQQQ, NIO, QQQ, JD, CCL, AAPL, NOK, ERIC, RLX"
2022-06-16 00:00:00,AAPL,"Why Meta, Amazon, and Apple Are Falling Today"
2022-06-16 00:00:00,AAPL,2 Simple Reasons to Buy Apple Stock
2022-06-16 00:00:00,AAPL,Does Apple’s Future Lie in Advertising? J.P. Morgan Thinks So
2022-06-16 00:00:00,AAPL,"After Hours Most Active for Jun 16, 2022 : IBN, IXUS, AAPL, CMCSA, QQQ, AMZN, MSFT, DNA, ELAN, UBER, GOLD, WFC"
2022-06-16 00:00:00,AAPL,Apple Stock Is Still a Good Long-Term Growth Investment
2022-06-16 00:00:00,AAPL,2 Reasons to Keep Purchasing Apple Stock During the Bear Market
2022-06-16 00:00:00,AAPL,"Pre-Market Most Active for Jun 16, 2022 : TQQQ, SQQQ, QQQ, NIO, BABA, AAPL, RDBX, UBS, TJX, AMZN, CCL, F"
2022-06-15 00:00:00,AAPL,Apple Stock: Plenty of Catalysts Could Fuel a Rebound
2022-06-15 00:00:00,AAPL,Apple Stock Is Strong … Almost to a Fault
2022-06-15 00:00:00,AAPL,"Apple Stock Is Worth Buying, Regardless of the WWDC Event"
2022-06-15 00:00:00,AAPL,"China COVID controls makes Apple supplier Pegatron ""emphasise"" expansion elsewhere"
2022-06-15 00:00:00,AAPL,"Apple TV App To Present All MLS Matches, Beginning 2023"
2022-06-14 00:00:00,AAPL,Apple (AAPL) Likely to Launch Its VR Headset in Early 2023
2022-06-14 00:00:00,AAPL,Apple (AAPL) Gains As Market Dips: What You Should Know
2022-06-14 00:00:00,AAPL,"After Hours Most Active for Jun 14, 2022 : ITUB, AUY, PYPL, QQQ, KO, AVDX, MSFT, VALE, AAPL, CLVT, SABR, BAC"
2022-06-14 00:00:00,AAPL,Apple (AAPL) Watch Gets FDA Nod for Parkinson's Monitoring
2022-06-14 00:00:00,AAPL,Adobe revamps metaverse design tools for Apple's chips
2022-06-14 00:00:00,AAPL,German cartel office examining Apple's tracking rules
2022-06-13 00:00:00,AAPL,Rune Labs gets FDA clearance to use Apple Watch to track Parkinson's symptoms
2022-06-13 00:00:00,AAPL,Why Apple Could Still Go Lower
2022-06-13 00:00:00,AAPL,"Notable ETF Inflow Detected - ITOT, AAPL, MSFT, PFE"
2022-06-13 00:00:00,AAPL,Rune Labs gets FDA clearance to use Apple Watch to track Parkinson's symptoms
2022-06-13 00:00:00,AAPL,"Apple music, gaming to bring in over $8 bln in revenue by 2025, JPM says"
2022-06-13 00:00:00,AAPL,Rune Labs gets FDA clearance to use Apple Watch to track Parkinson's symptoms
2022-06-13 00:00:00,AAPL,"Technology Sector Update for 06/13/2022: AAPL, PINS, BB, XLK, SOXX"
2022-06-13 00:00:00,AAPL,Apple Is Starting to Walk and Talk Like a Bank. Could It Ever Become One?
2022-06-11 00:00:00,AAPL,Is Apple About to Conquer This Innovative Big Tech Space?
2022-06-10 00:00:00,AAPL,This Is How Apple's WWDC Announcements Could Affect Your Stocks
2022-06-10 00:00:00,AAPL,"Notable Friday Option Activity: TSLA, AAPL, DAL"
2022-06-10 00:00:00,AAPL,Apple (AAPL) to Expand Apple TV+ Content With New Series 'Sugar'
2022-06-10 00:00:00,AAPL,"Why Apple, Amazon, and Nvidia Plunged Today"
2022-06-10 00:00:00,AAPL,"UK plans to probe Apple, Google's mobile browser dominance"
2022-06-10 00:00:00,AAPL,2 Reasons Investors Should Love Apple Pay Later
2022-06-10 00:00:00,AAPL,"UK plans to probe Apple, Google's mobile browser dominance"
2022-06-09 00:00:00,AAPL,Buy Apple Stock Now To Profit From Second-Half Rally
2022-06-09 00:00:00,AAPL,Apple Stock: The Bull and Bear Cases Today
2022-06-09 00:00:00,AAPL,"After Hours Most Active for Jun 9, 2022 : KGC, MO, JD, MRO, ETWO, BABA, PFE, QQQ, ADPT, AAPL, DOCU, FOLD"
2022-06-09 00:00:00,AAPL,Apple pay-later foray blurs tech-finance boundary
2022-06-09 00:00:00,AAPL,Apple (AAPL) Relies on Subsidiary to Manage Apple Pay Later
2022-06-09 00:00:00,AAPL,Interesting AAPL Put And Call Options For July 29th
2022-06-09 00:00:00,AAPL,Why the Shine Was Off Apple Stock Today
2022-06-09 00:00:00,AAPL,The Apple of Law Enforcement -- Is Axon a Top Stock to Buy Now?
2022-06-09 00:00:00,AAPL,Will the New M2 MacBook Air Be Enough to Kickstart Apple?
2022-06-09 00:00:00,AAPL,"China's smartphone makers chip away at Samsung, Apple's Russian market share"
2022-06-09 00:00:00,AAPL,Did Apple Just Put a Nail in Matterport's Coffin?
2022-06-08 00:00:00,AAPL,Apple to fund pay-later loans off its own balance sheet
2022-06-08 00:00:00,AAPL,The Deeper Implications of Apple's (AAPL) Shift Towards Service Revenue
2022-06-08 00:00:00,AAPL,"Apple's new car software no threat, complements our products, says Panasonic"
2022-06-07 00:00:00,AAPL,"Buy now, pay later stocks roiled by Apple's entry"
2022-06-07 00:00:00,AAPL,Apple (AAPL) Outpaces Stock Market Gains: What You Should Know
2022-06-07 00:00:00,AAPL,Apple Overhauls CarPlay With Major New Features
2022-06-07 00:00:00,AAPL,Apple Versus the Energy Sector: Which Is the Better Buy?
2022-06-07 00:00:00,AAPL,ANALYSIS-Apple's next frontier is your car's dashboard
2022-06-07 00:00:00,AAPL,"Pre-Market Most Active for Jun 7, 2022 : DIDI, SQQQ, C, TQQQ, AMZN, GM, AAPL, TGT, ET, KO, KHC, QQQ"
2022-06-07 00:00:00,AAPL,Apple Announces M2 Chip: What Investors Need to Know
2022-06-07 00:00:00,AAPL,Apple Stock: Why Now Is the Time to Buy
2022-06-07 00:00:00,AAPL,"EU countries, lawmakers clinch deal on single mobile charging port, Apple impacted"
2022-06-07 00:00:00,AAPL,Australia's BNPL stocks wilt after Apple announces entry
2022-06-07 00:00:00,AAPL,"Apple Pay Later Just Crushed Affirm's Dreams, but It's a Nice Win for 2 Fintech Giants"
2022-06-06 00:00:00,AAPL,Apple Unveils Redesigned MacBook Air With M2 Chip
2022-06-06 00:00:00,AAPL,"Representing 40% of Warren Buffett's Portfolio, Here Is Why Apple Is a Great Stock to Own Today"
2022-06-06 00:00:00,AAPL,"After Hours Most Active for Jun 6, 2022 : DIDI, C, TAL, BABA, KGC, BEKE, AAPL, IQ, PYPL, MSFT, LI, QCOM"
2022-06-06 00:00:00,AAPL,"As Apple upgrades its software, developers hunt for headset hints"
2022-06-06 00:00:00,AAPL,Daily Markets: Apple's (AAPL) 2022 WWDC Gets Underway
