Date,Stock_symbol,Article_title
2023-09-07 00:00:00,AAPL,"GLOBAL MARKETS-Stocks fall with Apple, dollar rises after U.S. data"
2023-09-07 00:00:00,AAPL,"Dow Movers: AAPL, JNJ"
2023-09-07 00:00:00,AAPL,Why Apple Stock Just Dropped 5%
2023-09-07 00:00:00,AAPL,US House panel chair: wider Chinese iPhone ban aims to quash Apple's market access
2023-09-07 00:00:00,AAPL,Stocks Lower as Weakness in Apple Weighs on Tech Stocks
2023-09-07 00:00:00,AAPL,"US STOCKS-S&P, Nasdaq fall as Apple drags, jobless claims data fuels rate jitters"
2023-09-07 00:00:00,AAPL,Apple Stock: Should You Buy the Dip Ahead of Tuesday's iPhone 15 Launch?
2023-09-06 00:00:00,AAPL,"Wall St slides as economic data stokes inflation worries, Apple drags"
2023-09-06 00:00:00,AAPL,"Technology Sector Update for 09/06/2023: PLAB, AAPL, ROKU, MVLA"
2023-09-06 00:00:00,AAPL,"Technology Sector Update for 09/06/2023: AAPL, ROKU, MVLA"
2023-09-06 00:00:00,AAPL,"US STOCKS-Wall St slides as services data stokes inflation worries, Apple drags"
2023-09-05 00:00:00,AAPL,Apple execs lose bid to block testimony at Google antitrust trial
2023-09-05 00:00:00,AAPL,Google vs. Apple: Which Smartphone Stock is a Better Buy?
2023-09-05 00:00:00,AAPL,"After Hours Most Active for Sep 5, 2023 : AMZN, PYPL, MSFT, CTLT, MU, AAPL, FRSH, KIM, JBGS, NEE, KKR^C, BAC"
2023-09-05 00:00:00,AAPL,Dow Analyst Moves: AAPL
2023-09-05 00:00:00,AAPL,A Bull Market Could Be Here: 2 Reasons to Buy Apple Stock
2023-09-04 00:00:00,AAPL,Apple’s (NASDAQ:AAPL) Upcoming Launch Event: The Ultimate Litmus Test
2023-09-04 00:00:00,AAPL,"Apple and Microsoft say some services not popular to be ""gatekeepers"" under EU's new Digital Market Act- FT"
2023-09-01 00:00:00,AAPL,Should You Buy the Dow Stock Outperforming Apple?
2023-09-01 00:00:00,AAPL,"After Hours Most Active for Sep 1, 2023 : BKI, AAPL, VZ, PYPL, CVE, MU, QQQ, TSLA, BHC, CSX, CNQ, ICE"
2023-09-01 00:00:00,AAPL,Apple (AAPL) Outpaces Stock Market Gains: What You Should Know
2023-09-01 00:00:00,AAPL,Is Trending Stock Apple Inc. (AAPL) a Buy Now?
2023-08-31 00:00:00,AAPL,Why the Top Fintech FAANG Stock Isn't Apple or Google
2023-08-31 00:00:00,AAPL,Microsoft vs Apple: Which Is the Better Dividend Stock?
2023-08-31 00:00:00,AAPL,"After Hours Most Active for Aug 31, 2023 : AAPL, T, NEX, PTEN, DKNG, PFE, F, NU, MSFT, HOOD, UGI, CSCO"
2023-08-31 00:00:00,AAPL,"1 Super Stock Set to Join Apple, Microsoft, Amazon, Alphabet, and Nvidia in the $1 Trillion Club"
2023-08-30 00:00:00,AAPL,Apple starts testing 3D printers to make smartwatch casings - Bloomberg News
2023-08-30 00:00:00,AAPL,"After Hours Most Active for Aug 30, 2023 : INTC, BEKE, DIS, KVUE, AMZN, FOCS, CRM, BKI, NWL, AAPL, RLJ, PYPL"
2023-08-30 00:00:00,AAPL,"Will A New $1,200 iPhone Help Apple Vendors Like Jabil Stock?"
2023-08-30 00:00:00,AAPL,"Top Research Reports for Apple, Broadcom & Caterpillar"
2023-08-30 00:00:00,AAPL,Why Is Everyone Talking About Apple Stock?
2023-08-29 00:00:00,AAPL,"After Hours Most Active for Aug 29, 2023 : KVUE, IGSB, TAL, VCLT, AAPL, CSCO, NVDA, IONQ, MSFT, JNJ, NOK, NEE"
2023-08-29 00:00:00,AAPL,"Apple to host fall event on Sept 12, analysts expect new iPhones"
2023-08-29 00:00:00,AAPL,Apple partner Globalstar taps former Qualcomm exec Jacobs as CEO
2023-08-29 00:00:00,AAPL,"Unusual Put Option Trade in Apple (AAPL) Worth $2,964.00K"
2023-08-28 00:00:00,AAPL,What's Going On With Apple Stock?
2023-08-28 00:00:00,AAPL,What to Expect from Apple (AAPL) Stock In September as iPhone Launch Approaches
2023-08-28 00:00:00,AAPL,"AAPL, META, and TSLA Stocks: What’s Ahead After August Correction?"
2023-08-28 00:00:00,AAPL,1 Catalyst for Apple Stock Investors
2023-08-27 00:00:00,AAPL,Better Growth Stock: Apple vs. AMD
2023-08-27 00:00:00,AAPL,Nearly 38% of Warren Buffett's Portfolio Is Invested in This 1 Sector If Apple Is Left Out of the Mix
2023-08-26 00:00:00,AAPL,Great News for Apple Stock Investors
2023-08-25 00:00:00,AAPL,"After Hours Most Active for Aug 25, 2023 : AAPL, VHNA, QQQ, JNJ, MSFT, TNET, CSX, SWN, GOOG, PFE, NEE, XOM"
2023-08-25 00:00:00,AAPL,Warren Buffett Detailed Fundamental Analysis - AAPL
2023-08-25 00:00:00,AAPL,"IVV, AAPL, MSFT, AMZN: ETF Inflow Alert"
2023-08-25 00:00:00,AAPL,Apple Stock: Buy the 10% Dip Because the Future Looks Bright
2023-08-25 00:00:00,AAPL,"Noteworthy Friday Option Activity: ENPH, GS, AAPL"
2023-08-25 00:00:00,AAPL,"Cathie Wood's Ark Invest Thinks Apple, Alphabet, and Nvidia Are Risky. Here Are 2 Artificial Intelligence (AI) Stocks That Could Be Better."
2023-08-25 00:00:00,AAPL,Here's Why Apple's Services Segment Is Crucially Important
2023-08-24 00:00:00,AAPL,"Unusual Put Option Trade in Apple (AAPL) Worth $1,776.30K"
2023-08-24 00:00:00,AAPL,Guru Fundamental Report for AAPL - Warren Buffett
2023-08-24 00:00:00,AAPL,"Zacks Investment Ideas feature highlights: Apple, Nasdaq 100 Index ETF, Super Micro Computer and S&P 500 Index ETF"
2023-08-23 00:00:00,AAPL,"Amid Slowing Growth, Apple's Ace in the Hole Is More Important Than Ever"
2023-08-23 00:00:00,AAPL,1 Supercharged Growth Stock That's a Shoo-in to Join Apple and Microsoft in the $2 Trillion Club by 2028
2023-08-23 00:00:00,AAPL,Apple endorses California bill on 'Right to Repair'
2023-08-23 00:00:00,AAPL,Is Apple the Best Buyer for ESPN?
2023-08-23 00:00:00,AAPL,AAPL Factor-Based Stock Analysis - Warren Buffett
2023-08-23 00:00:00,AAPL,1 Thing Investors Should Know About Apple's Revenue in 2023
2023-08-22 00:00:00,AAPL,Apple’s Buyback Blunder: 3 Reasons It’s Not a Win for AAPL Shareholders
2023-08-22 00:00:00,AAPL,AAPL Quantitative Stock Analysis - Warren Buffett
2023-08-21 00:00:00,AAPL,Apple and Spotify: 2 AI Stock Plays in Music Streaming
2023-08-21 00:00:00,AAPL,Lawsuit claiming Apple Watch sensor exhibits 'racial bias' is dismissed
2023-08-21 00:00:00,AAPL,Apple and Spotify: 2 Music Streaming AI Stocks to Scoop Up in August
2023-08-21 00:00:00,AAPL,"Unusual Call Option Trade in Apple (AAPL) Worth $1,699.45K"
2023-08-21 00:00:00,AAPL,It's Time to Load Up on Apple Stock
2023-08-21 00:00:00,AAPL,Apple Inc. (AAPL) is Attracting Investor Attention: Here is What You Should Know
2023-08-21 00:00:00,AAPL,Will Apple's iPhone 15 Launch & AI Innovations Spark New Uptrend?
2023-08-21 00:00:00,AAPL,Best Dividend Stocks: Apple Stock vs. Microsoft Stock
2023-08-21 00:00:00,AAPL,"The Zacks Analyst Blog Highlights Apple, NVIDIA, Bank of America, Nike and Prologis"
2023-08-20 00:00:00,AAPL,"Should Apple Buy ESPN From Disney? Wall Street Analyst Dan Ives Thinks It's a ""No-Brainer"""
2023-08-18 00:00:00,AAPL,"After Hours Most Active for Aug 18, 2023 : MRCY, KMI, RLJ, CHK, EGHT, JNJ, AVPT, TSN, AAPL, PANW, D, WEAV"
2023-08-18 00:00:00,AAPL,"Top Stock Reports for Apple, NVIDIA & Bank of America"
2023-08-18 00:00:00,AAPL,Warren Buffett Detailed Fundamental Analysis - AAPL
2023-08-17 00:00:00,AAPL,"Noteworthy ETF Inflows: IVV, AAPL, MSFT, AMZN"
2023-08-17 00:00:00,AAPL,"Noteworthy Thursday Option Activity: AAPL, MMM, COIN"
2023-08-17 00:00:00,AAPL,Wedbush Reiterates Apple (AAPL) Outperform Recommendation
2023-08-17 00:00:00,AAPL,Apple Stock (NASDAQ:AAPL): Near-Term Headwinds Fuel Cautious Sentiment
2023-08-17 00:00:00,AAPL,Guru Fundamental Report for AAPL - Warren Buffett
2023-08-16 00:00:00,AAPL,AAPL Factor-Based Stock Analysis - Warren Buffett
2023-08-16 00:00:00,AAPL,"Unusual Put Option Trade in Apple (AAPL) Worth $37,350.00K"
2023-08-16 00:00:00,AAPL,"Will Apple Acquire Disney? Probably Not, and Here's Why"
2023-08-16 00:00:00,AAPL,"Pre-Market Most Active for Aug 16, 2023 : AAPL, NIO, SQQQ, TQQQ, TSLA, TGT, TSEM, MRVL, C, AMC, WMT, COHR"
2023-08-16 00:00:00,AAPL,More Reasons to Bite Into Apple (AAPL) Stock
2023-08-15 00:00:00,AAPL,"Technology Sector Update for 08/15/2023: JMIA, SE, WLDS, AAPL, RUM"
2023-08-15 00:00:00,AAPL,"Technology Sector Update for 08/15/2023: SE, WLDS, RUM, AAPL"
2023-08-15 00:00:00,AAPL,Is Apple Stock a Buy?
2023-08-15 00:00:00,AAPL,AAPL Quantitative Stock Analysis - Warren Buffett
2023-08-15 00:00:00,AAPL,This Wall Street Strategist Predicted Apple's Ascent to $3 Trillion -- Now He Says 2 Artificial Intelligence (AI) Growth Stocks Will Win the Robotaxi Race
2023-08-15 00:00:00,AAPL,See Which Of The Latest 13F Filers Holds Apple
2023-08-15 00:00:00,AAPL,"Pre-Market Most Active for Aug 15, 2023 : TSHA, SQQQ, AAPL, AMD, TQQQ, SE, DASH, NVDA, AMC, NIO, APE, PLTR"
2023-08-14 00:00:00,AAPL,"After Hours Most Active for Aug 14, 2023 : BMY, BAC, AAPL, GOOGL, MSFT, CSCO, INTC, GOOG, TFC, KMI, NU, WMT"
2023-08-14 00:00:00,AAPL,Should You Buy the Dip in Apple Stock?
2023-08-14 00:00:00,AAPL,"Investors Look at Apple, Amazon, and More"
2023-08-14 00:00:00,AAPL,Ford taps Apple exec to build high-margin digital services
2023-08-14 00:00:00,AAPL,"Apple supplier Foxconn's Q2 profit slips 1%, better than forecasts"
2023-08-13 00:00:00,AAPL,Guru Fundamental Report for AAPL - Warren Buffett
2023-08-12 00:00:00,AAPL,1 Apple Chip Supplier Might Hold the Key to Understanding When iPhone Sales Rebound
2023-08-11 00:00:00,AAPL,"GQG Partners adds Nvidia, Amazon, Apple in Q2"
2023-08-11 00:00:00,AAPL,"After Hours Most Active for Aug 11, 2023 : RIG, BAC, KMI, JNJ, KVUE, AMZN, NVST, QQQ, MSFT, REAL, AAPL, KHC"
2023-08-11 00:00:00,AAPL,Warren Buffett Detailed Fundamental Analysis - AAPL
2023-08-11 00:00:00,AAPL,Better Buy: Apple vs. Alphabet
2023-08-11 00:00:00,AAPL,Apple (AAPL) Declares $0.24 Dividend
2023-08-10 00:00:00,AAPL,"Caltech reaches 'potential settlement' in Apple, Broadcom patent case"
2023-08-10 00:00:00,AAPL,"After Hours Most Active for Aug 10, 2023 : JNJ, AMZN, KVUE, PFE, MSFT, BMY, PR, DIS, SABR, WBD, AAPL, QQQ"
2023-08-10 00:00:00,AAPL,Guru Fundamental Report for AAPL - Warren Buffett
2023-08-10 00:00:00,AAPL,Apple Stock: Buy the Dip?
2023-08-10 00:00:00,AAPL,Apple Inc. (AAPL) Is a Trending Stock: Facts to Know Before Betting on It
2023-08-09 00:00:00,AAPL,US Supreme Court refuses Epic bid to let App Store order take effect in Apple case
2023-08-09 00:00:00,AAPL,US Supreme Court refuses Epic bid to let App Store order take effect in Apple case
2023-08-09 00:00:00,AAPL,"After Hours Most Active for Aug 9, 2023 : ET, KVUE, EQT, DIS, QQQ, CSCO, INTC, JNJ, AAPL, AMZN, T, TTD"
2023-08-09 00:00:00,AAPL,"Ex-Dividend Reminder: Rockwell Automation, Apple and Dolby Laboratories"
2023-08-09 00:00:00,AAPL,Is It Too Late to Buy Apple Stock?
2023-08-09 00:00:00,AAPL,AAPL Factor-Based Stock Analysis - Warren Buffett
2023-08-09 00:00:00,AAPL,"1 Green Flag for Apple in 2023, and 1 Red Flag"
2023-08-09 00:00:00,AAPL,Better Buy: Amazon vs. Apple
2023-08-09 00:00:00,AAPL,Here's Why I Don't Think Apple Stock Is a Buy Anymore
2023-08-08 00:00:00,AAPL,"Apple's 'Tetris' movie ripped off tech writer's book, lawsuit says"
2023-08-08 00:00:00,AAPL,Apple's $3 Trillion Valuation May Be Gone for Good
2023-08-08 00:00:00,AAPL,AAPL Quantitative Stock Analysis - Warren Buffett
2023-08-08 00:00:00,AAPL,Apple and Samsung to invest in SoftBank's Arm at IPO -Nikkei
2023-08-08 00:00:00,AAPL,Are the Good Times Over for Apple Stock?
2023-08-08 00:00:00,AAPL,1 Billion Reasons to Buy Apple Stock Hand Over Fist Now and Never Sell
2023-08-08 00:00:00,AAPL,"Pre-Market Most Active for Aug 8, 2023 : SQQQ, PLTR, AAPL, NKLA, NVAX, TQQQ, INTC, NIO, AMC, IONQ, NVO, WFC"
2023-08-08 00:00:00,AAPL,"META, AMZN, or AAPL: Which FAANG Stock is the Best Pick?"
2023-08-07 00:00:00,AAPL,"After Hours Most Active for Aug 7, 2023 : PLTR, TLT, SHY, LCID, CVX, AAPL, BAC, C, WFC, VTRS, MSFT, ET"
2023-08-07 00:00:00,AAPL,"Dow Movers: AAPL, BA"
2023-08-07 00:00:00,AAPL,"Berkshire Hathaway stock sets record high as rising rates, Apple boost profit"
2023-08-07 00:00:00,AAPL,Time to Bite on the Dip in Apple Stock After Earnings?
2023-08-07 00:00:00,AAPL,Relative Strength Alert For Apple
2023-08-07 00:00:00,AAPL,AAPL Stock’s Pullback: A Golden Opportunity for Long-term Apple Investors?
2023-08-07 00:00:00,AAPL,Better Buy: Apple vs. Amazon
2023-08-07 00:00:00,AAPL,"Buy Amazon Stock, but Avoid Apple for Now, Says Analyst"
2023-08-06 00:00:00,AAPL,Guru Fundamental Report for AAPL - Warren Buffett
2023-08-06 00:00:00,AAPL,iPhone Sales Are Slowing. Here's Why Apple Doesn't Really Care.
2023-08-05 00:00:00,AAPL,Will Tesla Follow in Apple's Footsteps?
2023-08-04 00:00:00,AAPL,Did Apple and Amazon Report “Magnificent” Earnings?
2023-08-04 00:00:00,AAPL,"Technology Sector Update for 08/04/2023: USM, TDS, AMZN, AAPL, AAOI"
2023-08-04 00:00:00,AAPL,"US STOCKS-Wall Street closes lower after US jobs report, Apple weighs"
2023-08-04 00:00:00,AAPL,"After Hours Most Active for Aug 4, 2023 : AAPL, NKLA, PDCE, T, QQQ, AMZN, HPE, ENB, TLT, ELAN, VZ, BAC"
2023-08-04 00:00:00,AAPL,US STOCKS-Wall Street ends lower after US jobs report; Apple weighs
2023-08-04 00:00:00,AAPL,Stocks Dragged Lower by Losses in Apple
2023-08-04 00:00:00,AAPL,Canaccord Genuity Maintains Apple (AAPL) Buy Recommendation
2023-08-04 00:00:00,AAPL,Apple Stock (NASDAQ:AAPL): This Quiet Winner of the AI Race Still Has Upside
2023-08-04 00:00:00,AAPL,"Technology Sector Update for 08/04/2023: AMZN, AAPL, AAOI"
2023-08-04 00:00:00,AAPL,"Dow Movers: AAPL, AMGN"
2023-08-04 00:00:00,AAPL,"Apple's (AAPL) Q3 Earnings Beat Estimates, Revenues Decline Y/Y"
2023-08-04 00:00:00,AAPL,"Daily Dividend Report: AAPL, NKE, UPS, ADP, MAR"
2023-08-04 00:00:00,AAPL,Morgan Stanley Maintains Apple (AAPL) Overweight Recommendation
2023-08-04 00:00:00,AAPL,Warren Buffett Detailed Fundamental Analysis - AAPL
2023-08-04 00:00:00,AAPL,"Technology Sector Update for 08/04/2023: TEAM, NET, AAPL, XLK, XSD"
2023-08-04 00:00:00,AAPL,"Daily Markets: Apple, Amazon, and Jobs Report Leads the Way Today"
2023-08-04 00:00:00,AAPL,Needham Reiterates Apple (AAPL) Buy Recommendation
2023-08-04 00:00:00,AAPL,"Pre-Market Most Active for Aug 4, 2023 : NKLA, TUP, QS, AMZN, SQQQ, TQQQ, FUBO, NIO, AAPL, YELL, PLTR, DT"
2023-08-04 00:00:00,AAPL,Citigroup Reiterates Apple (AAPL) Buy Recommendation
2023-08-04 00:00:00,AAPL,"AAPL, AMZN, AMD: Is There More Upside Left in These Buzzing Reddit Stocks?"
2023-08-04 00:00:00,AAPL,"Amazon Frankfurt-listed shares surge, Apple slides after results"
2023-08-04 00:00:00,AAPL,"Warren Buffett Has Bought Shares of This Company for 19 Consecutive Quarters -- and No, It's Not Apple"
2023-08-04 00:00:00,AAPL,"Helped By Strong Services Growth, Apple Earnings Just Returned to Growth"
2023-08-04 00:00:00,AAPL,"Amazon surges on 'game-changing' quarter, iPhone slump drags Apple"
2023-08-03 00:00:00,AAPL,"US STOCKS-Wall Street closes near flat as Treasury yields surge; Apple, Amazon to report"
2023-08-03 00:00:00,AAPL,"Apple, Amazon, Airbnb Beat on Earnings, Sales"
2023-08-03 00:00:00,AAPL,"Apple profit tops Wall Street targets, strong services counter weaker iPhone"
2023-08-03 00:00:00,AAPL,"Apple Inc. Q3 Income Climbs, Beats estimates"
2023-08-03 00:00:00,AAPL,"Apple profit tops Wall Street targets, strong services counter weaker iPhone"
2023-08-03 00:00:00,AAPL,"After Hours Most Active for Aug 3, 2023 : AMZN, AAPL, ELAN, TQQQ, QQQ, SU, SQQQ, ZYME, PAG, PFE, SQ, UGI"
2023-08-03 00:00:00,AAPL,Will Apple and Amazon’s Earnings Justify Lofty Price Levels?
2023-08-03 00:00:00,AAPL,"Unusual Put Option Trade in Apple (AAPL) Worth $1,165.60K"
2023-08-03 00:00:00,AAPL,Apple Stock Price Outlook: The Road to $400 and Beyond
2023-08-03 00:00:00,AAPL,"Compared to Estimates, Apple (AAPL) Q3 Earnings: A Look at Key Metrics"
2023-08-03 00:00:00,AAPL,"The Zacks Analyst Blog Highlights Apple, Amazon, MGK, BIGT, QQQ and AAPU"
2023-08-03 00:00:00,AAPL,Apple (AAPL) Q3 2023 Earnings: What to Expect
2023-08-03 00:00:00,AAPL,Guru Fundamental Report for AAPL - Warren Buffett
2023-08-03 00:00:00,AAPL,AAPL Earnings Today: Here’s What to Expect from the iPhone Maker in Fiscal Q3
2023-08-03 00:00:00,AAPL,Russia fines Apple for not deleting 'inaccurate' content on Ukraine conflict -TASS
2023-08-03 00:00:00,AAPL,Apple Q3 23 Earnings Conference Call At 5:00 PM ET
2023-08-03 00:00:00,AAPL,Better Artificial Intelligence Stock: Apple vs. Microsoft
2023-08-02 00:00:00,AAPL,JP Morgan Maintains Apple (AAPL) Overweight Recommendation
2023-08-02 00:00:00,AAPL,"After Hours Most Active for Aug 2, 2023 : IGSB, QQQ, AAPL, PYPL, BAC, SHOP, ELAN, BMY, TLT, JBLU, BTU, SU"
2023-08-02 00:00:00,AAPL,"Notable Wednesday Option Activity: PINS, GKOS, AAPL"
2023-08-02 00:00:00,AAPL,Apple's high-yield savings account hits over $10 bln in customer deposits
2023-08-02 00:00:00,AAPL,Apple Stock: Buy or Sell Ahead of This Week's Earnings Report?
2023-08-02 00:00:00,AAPL,Why Apple (AAPL) Might Surprise This Earnings Season
2023-08-02 00:00:00,AAPL,3 Things About Apple That Smart Investors Know
2023-08-02 00:00:00,AAPL,"Apple, Amazon and 3 Other Key Earnings Charts"
2023-08-02 00:00:00,AAPL,"Apple, Amazon to Report Earnings: ETFs in Spotlight"
2023-08-02 00:00:00,AAPL,"Zacks Investment Ideas feature highlights: AT&T, Apple, Verizon and Occidental Petroleum"
2023-08-02 00:00:00,AAPL,PREVIEW-Apple heads for largest Q3 revenue drop since 2016 as iPhone sales slow
2023-08-01 00:00:00,AAPL,Apple Stock: Headed to $220?
2023-08-01 00:00:00,AAPL,Here's How Apple Could Win Big From AI
2023-08-01 00:00:00,AAPL,Apple (AAPL) to Report Q3 Earnings: What's in the Offing?
2023-08-01 00:00:00,AAPL,"After Hours Most Active for Aug 1, 2023 : AMD, QQQ, PINS, C, F, RIG, XOM, EQT, AAPL, BND, YELL, CSCO"
2023-08-01 00:00:00,AAPL,TD Cowen Maintains Apple (AAPL) Outperform Recommendation
2023-08-01 00:00:00,AAPL,PREVIEW-Apple heads for largest Q3 revenue drop since 2016 as iPhone sales slow
2023-08-01 00:00:00,AAPL,Amazon & Apple Earnings: What to Expect
2023-08-01 00:00:00,AAPL,"India asks Tesla to copy Apple in pairing Chinese, Indian suppliers -sources"
2023-08-01 00:00:00,AAPL,"GRAPHIC-Apple, Microsoft remain world's top 2 companies by market cap"
2023-08-01 00:00:00,AAPL,AAPL Quantitative Stock Analysis - Warren Buffett
2023-07-31 00:00:00,AAPL,Apple supplier Foxconn plans $500 mln component factories in India - Bloomberg News
2023-07-31 00:00:00,AAPL,"As Disney Leads the Week in Unusual Options Flow, NVDA, AAPL, XPEV Follow"
2023-07-31 00:00:00,AAPL,Two Foolproof Plays for Apple’s Earnings
2023-07-31 00:00:00,AAPL,"Apple, Amazon, Starbucks, Uber and others are part of Zacks Earnings Preview"
2023-07-30 00:00:00,AAPL,"If You'd Invested $1,000 in Apple in 2000, This Is How Much You'd Have Today"
2023-07-30 00:00:00,AAPL,"Weekly Preview: Earnings to Watch This Week 7-30-23 (AAPL, AMD, AMZN, SQ)"
2023-07-30 00:00:00,AAPL,Guru Fundamental Report for AAPL - Warren Buffett
2023-07-28 00:00:00,AAPL,"Unusual Call Option Trade in Apple (AAPL) Worth $4,537.50K"
2023-07-28 00:00:00,AAPL,My Apple Stock Price Prediction for 2025
2023-07-27 00:00:00,AAPL,Bernstein Maintains Apple (AAPL) Market Perform Recommendation
2023-07-27 00:00:00,AAPL,Apple Reports After the Close on 8/3 -- Options Contracts Expire the Next Day
2023-07-27 00:00:00,AAPL,"Meta, Microsoft, and Amazon Team Up to Take Down Apple and Alphabet in a Key Segment. Here's What Investors Should Know."
2023-07-27 00:00:00,AAPL,Guru Fundamental Report for AAPL - Warren Buffett
2023-07-27 00:00:00,AAPL,Wish You'd Bought Apple Stock in 2009? Top Analyst Dan Ives Says Do This Right Now.
2023-07-27 00:00:00,AAPL,"Zacks Investment Ideas feature highlights: Apple, Palo Alto Networks, Microsoft, Fidelity Contra and Amazon"
2023-07-26 00:00:00,AAPL,"After Hours Most Active for Jul 26, 2023 : META, TLGA, AMZN, AAPL, DBX, GOOG, XOM, BAC, DIS, SQQQ, BOND, VZ"
2023-07-26 00:00:00,AAPL,Better Artificial Intelligence Stock: Apple vs. Amazon
2023-07-26 00:00:00,AAPL,"Zacks Investment Ideas feature highlights: Apple, Adidas and Anheuser-Busch"
2023-07-26 00:00:00,AAPL,"Noteworthy Wednesday Option Activity: AMZN, ENPH, AAPL"
2023-07-26 00:00:00,AAPL,Samsung unveils new foldable phones to challenge Apple's premium dominance
2023-07-26 00:00:00,AAPL,"The Zacks Analyst Blog Highlights Spotify, Apple Music, Amazon Music, Sony and Live Nation"
2023-07-26 00:00:00,AAPL,AAPL Factor-Based Stock Analysis - Warren Buffett
2023-07-26 00:00:00,AAPL,Will Apple Stock End the Year Above $200 Per Share?
2023-07-25 00:00:00,AAPL,AAPL Quantitative Stock Analysis - Warren Buffett
2023-07-25 00:00:00,AAPL,French antitrust watchdog issues statement of objection over Apple app tracking
2023-07-25 00:00:00,AAPL,Morgan Stanley Reiterates Apple (AAPL) Overweight Recommendation
2023-07-25 00:00:00,AAPL,"1 Green Flag for Apple in 2023, and 1 Red Flag"
2023-07-24 00:00:00,AAPL,Wells Fargo Maintains Apple (AAPL) Overweight Recommendation
2023-07-24 00:00:00,AAPL,Deutsche Bank Maintains Apple (AAPL) Buy Recommendation
2023-07-24 00:00:00,AAPL,Apple (AAPL) Outpaces Stock Market Gains: What You Should Know
2023-07-24 00:00:00,AAPL,Apple faces $1 bln UK lawsuit by apps developers over app store fees
2023-07-24 00:00:00,AAPL,Apple's AI Plans Are Bigger Than You Think
2023-07-24 00:00:00,AAPL,Apple aims to keep iPhone shipments steady - Bloomberg News
2023-07-24 00:00:00,AAPL,Apple aims to keep iPhone shipments steady - Bloomberg News
2023-07-24 00:00:00,AAPL,"Technology Sector Update for 07/24/2023: WKEY, SPOT, AAPL, XLK, XSD"
2023-07-24 00:00:00,AAPL,Here's Where Warren Buffett Has Invested Over $100 Billion Right Now (and It's Not Apple)
2023-07-24 00:00:00,AAPL,"IVV, AAPL, MSFT, AMZN: ETF Inflow Alert"
2023-07-23 00:00:00,AAPL,Guru Fundamental Report for AAPL - Warren Buffett
2023-07-22 00:00:00,AAPL,Unusual Put Option Trade in Apple (AAPL) Worth $874.38K
2023-07-21 00:00:00,AAPL,"Buying Tesla Stock Today Could Be Like Buying Apple Stock in 2009, According to This Wall Street Strategist"
2023-07-21 00:00:00,AAPL,Warren Buffett Detailed Fundamental Analysis - AAPL
2023-07-21 00:00:00,AAPL,"Zacks Investment Ideas feature highlights: Apple, Visa and Broadcom"
2023-07-20 00:00:00,AAPL,"Technology Sector Update for 07/20/2023: AAPL, SAP, OMCL, RCAT"
2023-07-20 00:00:00,AAPL,Credit Suisse Maintains Apple (AAPL) Outperform Recommendation
2023-07-20 00:00:00,AAPL,Better Buy: Apple Stock vs. Microsoft Stock
2023-07-20 00:00:00,AAPL,Guru Fundamental Report for AAPL - Warren Buffett
2023-07-20 00:00:00,AAPL,Four Reasons Why Apple Could Soar To New Highs In Q3
2023-07-20 00:00:00,AAPL,Why the Worry Warts Are Wrong About Apple Stock
2023-07-19 00:00:00,AAPL,"Technology Sector Update for 07/19/2023: AAPL, U, MSFT, ATVI"
2023-07-19 00:00:00,AAPL,Apple tests generative AI tools to rival OpenAI's ChatGPT - Bloomberg News
2023-07-19 00:00:00,AAPL,"Technology Sector Update for 07/19/2023: SRT, AAPL, U, MSFT, ATVI"
2023-07-19 00:00:00,AAPL,Investors Heavily Search Apple Inc. (AAPL): Here is What You Need to Know
2023-07-19 00:00:00,AAPL,AAPL Factor-Based Stock Analysis - Warren Buffett
2023-07-19 00:00:00,AAPL,B of A Securities Maintains Apple (AAPL) Neutral Recommendation
2023-07-18 00:00:00,AAPL,"Spain antitrust watchdog fines Amazon, Apple $218 million"
2023-07-18 00:00:00,AAPL,AAPL Quantitative Stock Analysis - Warren Buffett
2023-07-18 00:00:00,AAPL,Apple chided by appeals judge as it heads to US Supreme Court in antitrust case
2023-07-18 00:00:00,AAPL,"Noteworthy Tuesday Option Activity: MCFT, ENPH, AAPL"
2023-07-18 00:00:00,AAPL,"After Hours Most Active for Jul 18, 2023 : SQQQ, QQQ, AAPL, BEKE, AMZN, TQQQ, ENB, EXC, T, BAC, KO, SNAP"
2023-07-18 00:00:00,AAPL,"7 Remarkable Stocks That Could Join Apple, Microsoft, Nvidia, Amazon, and Alphabet in the $1 Trillion Club"
2023-07-18 00:00:00,AAPL,Is Apple Stock a Buy?
2023-07-18 00:00:00,AAPL,Apple vs. Microsoft: Which Is the Better Dividend Stock?
2023-07-18 00:00:00,AAPL,"Spain antitrust watchdog fines Amazon, Apple $218 million"
2023-07-17 00:00:00,AAPL,Apple (AAPL) Outpaces Stock Market Gains: What You Should Know
2023-07-17 00:00:00,AAPL,Apple (AAPL) Rumored to Bring Tap to Pay on iPhone to Brazil
2023-07-17 00:00:00,AAPL,Morgan Stanley Maintains Apple (AAPL) Overweight Recommendation
2023-07-17 00:00:00,AAPL,"Unusual Put Option Trade in Apple (AAPL) Worth $1,248.75K"
2023-07-16 00:00:00,AAPL,Guru Fundamental Report for AAPL - Warren Buffett
2023-07-15 00:00:00,AAPL,Great News for Apple Stock and Microsoft Stock Investors
2023-07-15 00:00:00,AAPL,"1 Super Stock That Could Join Apple, Microsoft, Nvidia, Amazon, and Google in the $1 Trillion Club"
2023-07-14 00:00:00,AAPL,Apple’s $3 Trillion Milestone: What’s Next for AAPL Stock Investors?
2023-07-14 00:00:00,AAPL,"After Hours Most Active for Jul 14, 2023 : ATVI, TTD, QQQ, MTCH, FACT, AMZN, AAPL, BEKE, XOM, ANF, T, KO"
2023-07-14 00:00:00,AAPL,See Which Of The Latest 13F Filers Holds Apple
2023-07-13 00:00:00,AAPL,"After Hours Most Active for Jul 13, 2023 : ROIV, IBN, AMZN, INTC, T, CMCSA, HPE, WBD, AAPL, BEKE, TFC, WMB"
2023-07-13 00:00:00,AAPL,Apple's (AAPL) Streaming Service Receives 54 Emmy Nominations
2023-07-13 00:00:00,AAPL,Apple Just Hit a $3 Trillion Market Cap. Here's Why It Could Get Even Bigger.
2023-07-13 00:00:00,AAPL,Apple Card’s Move from Goldman Sachs to Amex Could be a Big Deal
2023-07-13 00:00:00,AAPL,Guru Fundamental Report for AAPL - Warren Buffett
2023-07-12 00:00:00,AAPL,Better Buy: AMD vs. Apple
2023-07-12 00:00:00,AAPL,"After Hours Most Active for Jul 12, 2023 : AAPL, QQQ, PCG, AMZN, GOOGL, INTC, CMCSA, BP, TFC, KO, T, HBI"
2023-07-12 00:00:00,AAPL,How To YieldBoost AAPL From 0.5% To 3.5% Using Options
2023-07-12 00:00:00,AAPL,"At a $3 Trillion Market Cap, Has Apple's Stock Gotten Too Expensive?"
2023-07-12 00:00:00,AAPL,AAPL Factor-Based Stock Analysis - Warren Buffett
2023-07-12 00:00:00,AAPL,Is Apple Really Building a Car?
2023-07-12 00:00:00,AAPL,Apple Stock (NASDAQ:AAPL): Near-Term Headwinds Could Limit Further Upside
2023-07-11 00:00:00,AAPL,"After Hours Most Active for Jul 11, 2023 : COIN, KO, CL, KMI, NEM, RIG, TFC, RIVN, EMB, AAPL, QQQ, KBWB"
2023-07-11 00:00:00,AAPL,"Unusual Call Option Trade in Apple (AAPL) Worth $1,763.28K"
2023-07-11 00:00:00,AAPL,"Notable Tuesday Option Activity: AMZN, AAPL, ENPH"
